product_code,product_name,product_description,MRP,our_price,a. Whole Sale Price,shipping _charge,product_category,product_subcategory,product_subtopic,products_pagetitle,products_metadescription,products_keywords,image_url,Sub_Description ,brand,status
hom1,"Gala Kitchen Scrubber Green, Pack of 2",,59,,,,Home Care,Cleaning,,"Gala Kitchen Scrubber Green, Pack of 2",,,h1.jpg,,Gala,1
hom2,Gala Kitchen Wipe Combination Pack of 3,,108,,,,Home Care,Cleaning,,Gala Kitchen Wipe Combination Pack of 3,,,h2.jpg,,Gala,1
hom3,Gala Swash Card 20,,28,,,,Home Care,Cleaning,,Gala Swash Card 20,,,h3.jpg,,Gala,1
hom4,"Lizol Disinfectant Floor Cleaner Floral, 500 ml",,67,,,,Home Care,Cleaning,,"Lizol Disinfectant Floor Cleaner Floral, 500 ml",,,h4.jpg,,Lizol,1
hom5,"Harpic Bathroom Cleaner Lemon, 500 ml",,68,,,,Home Care,Cleaning,,"Harpic Bathroom Cleaner Lemon, 500 ml",,,h5.jpg,,Harpic,1
hom6,"Harpic Bathroom Cleaner Floral, 500 ml",,68,,,,Home Care,Cleaning,,"Harpic Bathroom Cleaner Floral, 500 ml",,,h6.jpg,,Harpic,1
hom7,"Scotch Brite Scrub Pad 4cm X 6 cm, Pack of 10 U",,250,,,,Home Care,Cleaning,,"Scotch Brite Scrub Pad 4cm X 6 cm, Pack of 10 U",,,h7.jpg,,Scotch,1
hom8,Vim Dishwash Bar 500 g,,42,,,,Home Care,Cleaning,,Vim Dishwash Bar 500 g,,,h8.jpg,,Vim,1
hom9,Vim Dish Wash Bar 90 g,,5,,,,Home Care,Cleaning,,Vim Dish Wash Bar 90 g,,,h9.jpg,,Vim,1
hom10,Scotch Brite Scrub Pad 10 cm X 14 cm,,28,,,,Home Care,Cleaning,,Scotch Brite Scrub Pad 10 cm X 14 cm,,,h10.jpg,,Scotch,1
hom11,Scotch Brite Net Sponge 11 cm X 7 cm,,35,,,,Home Care,Cleaning,,Scotch Brite Net Sponge 11 cm X 7 cm,,,h11.jpg,,Scotch,1
hom12,Scotch Brite Scrub Sponge 8 cm X 8 cm,,25,,,,Home Care,Cleaning,,Scotch Brite Scrub Sponge 8 cm X 8 cm,,,h12.jpg,,Scotch,1
hom13,Scotch Brite Scrub Combo Pack 15 g,,28,,,,Home Care,Cleaning,,Scotch Brite Scrub Combo Pack 15 g,,,h13.jpg,,Scotch,1
hom14,Scotch Brite Sponge 20 cm X 17.5 cm,,120,,,,Home Care,Cleaning,,Scotch Brite Sponge 20 cm X 17.5 cm,,,h14.jpg,,Scotch,1
hom15,"Hamara Bright Scrub Pad 7.5cm X 7.5cm, Pack of 6 U",,48,,,,Home Care,Cleaning,,"Hamara Bright Scrub Pad 7.5cm X 7.5cm, Pack of 6 U",,,h15.jpg,,Hamara,1
hom16,Britex Scrub Pad Pack of 3 U,,60,,,,Home Care,Cleaning,,Britex Scrub Pad Pack of 3 U,,,h16.jpg,,Britex,1
hom17,Mr.Muscle Glass Cleaner 500 ml,,72,,,,Home Care,Cleaning,,Mr.Muscle Glass Cleaner 500 ml,,,h17.jpg,,Mr.Muscle,1
hom18,"Kiwi Wax Shine Black, 15 g",,24,,,,Home Care,Cleaning,,"Kiwi Wax Shine Black, 15 g",,,h18.jpg,,Kiwi,1
hom19,Scotch Brite Jet Scrubber 1 U,,130,,,,Home Care,Cleaning,,Scotch Brite Jet Scrubber 1 U,,,h19.jpg,,Scotch,1
hom20,Scotch Brite Sponge 6 U,,180,,,,Home Care,Cleaning,,Scotch Brite Sponge 6 U,,,h20.jpg,,Scotch,1
hom21,Britex Steel Scrubber 10 U,,180,,,,Home Care,Cleaning,,Britex Steel Scrubber 10 U,,,h21.jpg,,Britex,1
hom22,Scotch Brite Steel Scrub 6 U,,168,,,,Home Care,Cleaning,,Scotch Brite Steel Scrub 6 U,,,h22.jpg,,Scotch,1
hom23,Scotch Brite Jet Scrubber 1 U,,120,,,,Home Care,Cleaning,,Scotch Brite Jet Scrubber 1 U,,,h23.jpg,,Scotch,1
hom24,"Scotch Brite Sponge 17.5 cm X 15 cm, Pack of 12 U",,480,,,,Home Care,Cleaning,,"Scotch Brite Sponge 17.5 cm X 15 cm, Pack of 12 U",,,h24.jpg,,Scotch,1
hom25,Kiwi Shoe Brush Mini,,49,,,,Home Care,Cleaning,,Kiwi Shoe Brush Mini,,,h25.jpg,,Kiwi,1
hom26,Cherry Shoe Polish 40 g,,46,,,,Home Care,Cleaning,,Cherry Shoe Polish 40 g,,,h26.jpg,,Cherry,1
hom27,Cherry Liquid Polish 75 ml,,64,,,,Home Care,Cleaning,,Cherry Liquid Polish 75 ml,,,h27.jpg,,Cherry,1
hom28,Taski Floor Cleaner 1 Litre,,181,,,,Home Care,Cleaning,,Taski Floor Cleaner 1 Litre,,,h28.jpg,,Taski,1
hom29,Taski Glass Cleaner 1 Litre,,230,,,,Home Care,Cleaning,,Taski Glass Cleaner 1 Litre,,,h29.jpg,,Taski,1
hom30,Domex Zero Stain Toilet Cleaner Pink 450 ml,,68,,,,Home Care,Cleaning,,Domex Zero Stain Toilet Cleaner Pink 450 ml,,,h30.jpg,,Domex,1
hom31,"Domex Zero Stain Toilet Cleaner Green, 450 ml",,68,,,,Home Care,Cleaning,,"Domex Zero Stain Toilet Cleaner Green, 450 ml",,,h31.jpg,,Domex,1
hom32,"Harpic Toilet Cleaner Orange, 1 Litre",,125,,,,Home Care,Cleaning,,"Harpic Toilet Cleaner Orange, 1 Litre",,,h32.jpg,,Harpic,1
hom33,"Harpic Toilet Cleaner Rose, 1 Litre",,125,,,,Home Care,Cleaning,,"Harpic Toilet Cleaner Rose, 1 Litre",,,h33.jpg,,Harpic,1
hom34,Taski Toilet Cleaner 500 ml,,70,,,,Home Care,Cleaning,,Taski Toilet Cleaner 500 ml,,,h34.jpg,,Taski,1
hom35,Kiwi Brush 2-In-1,,65,,,,Home Care,Cleaning,,Kiwi Brush 2-In-1,,,h35.jpg,,Kiwi,1
hom36,Kiwi Wax Shine Neutral 75 ml,,65,,,,Home Care,Cleaning,,Kiwi Wax Shine Neutral 75 ml,,,h36.jpg,,Kiwi,1
hom37,Kiwi Wax Shine Black 75 ml,,65,,,,Home Care,Cleaning,,Kiwi Wax Shine Black 75 ml,,,h37.jpg,,Kiwi,1
hom38,"Dettol Floor Cleaner Jasmine, 500 ml",,67,,,,Home Care,Cleaning,,"Dettol Floor Cleaner Jasmine, 500 ml",,,h38.jpg,,Dettol,1
hom39,"Dettol Floor Cleaner Pine, 975 ml",,123,,,,Home Care,Cleaning,,"Dettol Floor Cleaner Pine, 975 ml",,,h39.jpg,,Dettol,1
hom40,"Dettol Floor Cleaner Pine, 2 Litres",,246,,,,Home Care,Cleaning,,"Dettol Floor Cleaner Pine, 2 Litres",,,h40.jpg,,Dettol,1
hom41,Dettol Floor Cleaner 500 ml,,67,,,,Home Care,Cleaning,,Dettol Floor Cleaner 500 ml,,,h41.jpg,,Dettol,1
hom42,"Dettol Floor Cleaner Lavender, 500 ml",,67,,,,Home Care,Cleaning,,"Dettol Floor Cleaner Lavender, 500 ml",,,h42.jpg,,Dettol,1
hom43,"Dettol Floor Cleaner Floral, 975 ml",,123,,,,Home Care,Cleaning,,"Dettol Floor Cleaner Floral, 975 ml",,,h43.jpg,,Dettol,1
hom44,"Dettol Floor Cleaner Floral, 2 Litres",,246,,,,Home Care,Cleaning,,"Dettol Floor Cleaner Floral, 2 Litres",,,h44.jpg,,Dettol,1
hom45,"Dettol Floor Cleaner Citrus, 975 ml",,123,,,,Home Care,Cleaning,,"Dettol Floor Cleaner Citrus, 975 ml",,,h45.jpg,,Dettol,1
hom46,"Dettol Floor Cleaner Citrus, 2 Litres",,246,,,,Home Care,Cleaning,,"Dettol Floor Cleaner Citrus, 2 Litres",,,h46.jpg,,Dettol,1
hom47,Suma Multi Purpose Cleaner 1 Litre,,137,,,,Home Care,Cleaning,,Suma Multi Purpose Cleaner 1 Litre,,,h47.jpg,,Suman,1
hom48,Suma Multi Purpose Cleaner 5 Litres,,458,,,,Home Care,Cleaning,,Suma Multi Purpose Cleaner 5 Litres,,,h48.jpg,,Suman,1
hom49,"Taski Floor Cleaner R2, 5 Litres",,885,,,,Home Care,Cleaning,,"Taski Floor Cleaner R2, 5 Litres",,,h49.jpg,,Taski,1
hom50,Mr.Muscle Kitchen Cleaner 500 ml,,85,,,,Home Care,Cleaning,,Mr.Muscle Kitchen Cleaner 500 ml,,,h50.jpg,,Mr.Muscle,1
hom51,CIF Kitchen Cleaner 250 ml,,65,,,,Home Care,Cleaning,,CIF Kitchen Cleaner 250 ml,,,h51.jpg,,CIF Kitchen,1
hom52,"Dettol Dish Gel Lime, 750 ml",,150,,,,Home Care,Cleaning,,"Dettol Dish Gel Lime, 750 ml",,,h52.jpg,,Dettol,1
hom53,"Dettol Dish Gel Lime, 400 ml",,98,,,,Home Care,Cleaning,,"Dettol Dish Gel Lime, 400 ml",,,h53.jpg,,Dettol,1
hom54,"Dettol Dish Gel Lime, 200 ml",,52,,,,Home Care,Cleaning,,"Dettol Dish Gel Lime, 200 ml",,,h54.jpg,,Dettol,1
hom55,"Dettol Dish Gel Lemon, 750 ml",,150,,,,Home Care,Cleaning,,"Dettol Dish Gel Lemon, 750 ml",,,h55.jpg,,Dettol,1
hom56,"Dettol Dish Gel Lemon, 400 ml",,98,,,,Home Care,Cleaning,,"Dettol Dish Gel Lemon, 400 ml",,,h56.jpg,,Dettol,1
hom57,"Dettol Dish Gel Lemon, 200 ml",,52,,,,Home Care,Cleaning,,"Dettol Dish Gel Lemon, 200 ml",,,h57.jpg,,Dettol,1
hom58,"Dettol Dish Gel Lemon, 130 ml",,20,,,,Home Care,Cleaning,,"Dettol Dish Gel Lemon, 130 ml",,,h58.jpg,,Dettol,1
hom59,Odopic Dishwash Bar 500 g,,36,,,,Home Care,Cleaning,,Odopic Dishwash Bar 500 g,,,h59.jpg,,Odopic,1
hom60,"Vim Dish Wash Liquid, Anti-germ, 500 ml",,117,,,,Home Care,Cleaning,,"Vim Dish Wash Liquid, Anti-germ, 500 ml",,,h60.jpg,,Vim,1
hom61,"Vim Dish Wash Liquid, Anti-germ, 250 ml",,62,,,,Home Care,Cleaning,,"Vim Dish Wash Liquid, Anti-germ, 250 ml",,,h61.jpg,,Vim,1
hom62,Vim Dishwash Powder 1 kg,,24,,,,Home Care,Cleaning,,Vim Dishwash Powder 1 kg,,,h62.jpg,,Vim,1
hom63,"Mr Muscle Floor Cleaner Citrus, 1 Litre",,130,,,,Home Care,Cleaning,,"Mr Muscle Floor Cleaner Citrus, 1 Litre",,,h63.jpg,,Mr.Muscle,1
hom64,"Mr Muscle Floor Cleaner Floral, 1 Litre",,130,,,,Home Care,Cleaning,,"Mr Muscle Floor Cleaner Floral, 1 Litre",,,h64.jpg,,Mr.Muscle,1
hom65,"Mr Muscle Floor Cleaner Citrus, 501 ml",,66,,,,Home Care,Cleaning,,"Mr Muscle Floor Cleaner Citrus, 501 ml",,,h65.jpg,,Mr.Muscle,1
hom66,"Mr Muscle Floor Cleaner Floral, 500 ml",,66,,,,Home Care,Cleaning,,"Mr Muscle Floor Cleaner Floral, 500 ml",,,h66.jpg,,Mr.Muscle,1
hom67,Kiwi Shoe Sponge Black,,60,,,,Home Care,Cleaning,,Kiwi Shoe Sponge Black,,,h67.jpg,,Kiwi,1
hom68,"Kiwi Wax Shine Black, 40 g",,46,,,,Home Care,Cleaning,,"Kiwi Wax Shine Black, 40 g",,,h68.jpg,,Kiwi,1
hom69,"Cherry Liquid Polish 120 g, White Cleaner",,33,,,,Home Care,Cleaning,,"Cherry Liquid Polish 120 g, White Cleaner",,,h69.jpg,,Cherry,1
hom70,Cherry Liquid Polish 75 ml /Dark Tan,,64,,,,Home Care,Cleaning,,Cherry Liquid Polish 75 ml /Dark Tan,,,h70.jpg,,Cherry,1
hom71,"Cherry Shoe Polish 40 g, Dark Tan",,46,,,,Home Care,Cleaning,,"Cherry Shoe Polish 40 g, Dark Tan",,,h71.jpg,,Cherry,1
hom72,"Cherry Shoe Polish 15 g, Black",,24,,,,Home Care,Cleaning,,"Cherry Shoe Polish 15 g, Black",,,h72.jpg,,Cherry,1
hom73,"Colin Glass Cleaner Citrus, 500 ml",,72,,,,Home Care,Cleaning,,"Colin Glass Cleaner Citrus, 500 ml",,,h73.jpg,,Colin,1
hom74,Domex Zero Stain Toilet Cleaner 450 ml,,68,,,,Home Care,Cleaning,,Domex Zero Stain Toilet Cleaner 450 ml,,,h74.jpg,,Domex,1
hom75,Domex Zero Stain Toilet Cleaner 750 ml,,112,,,,Home Care,Cleaning,,Domex Zero Stain Toilet Cleaner 750 ml,,,h75.jpg,,Domex,1
hom76,"Scotch Brite Scrub Pad 7.5 cm X 7.5 cm, Pack of 12 U",,120,,,,Home Care,Cleaning,,"Scotch Brite Scrub Pad 7.5 cm X 7.5 cm, Pack of 12 U",,,h76.jpg,,Scotch,1
hom77,"Scotch Brite Scrub Pad 6 cm X 7.5 cm, Pack of 12 U",,84,,,,Home Care,Cleaning,,"Scotch Brite Scrub Pad 6 cm X 7.5 cm, Pack of 12 U",,,h77.jpg,,Scotch,1
hom78,Scotch Brite Scrub Pad Super Saver Pack,,82,,,,Home Care,Cleaning,,Scotch Brite Scrub Pad Super Saver Pack,,,h78.jpg,,Scotch,1
hom79,"Scotch Brite Scrub Pad 6.5 cm X 6.5 cm, Pack of 6 U",,108,,,,Home Care,Cleaning,,"Scotch Brite Scrub Pad 6.5 cm X 6.5 cm, Pack of 6 U",,,h79.jpg,,Scotch,1
hom80,"Scotch Brite Sponge 20 cm X 17.5 cm, Pack of 6 U",,270,,,,Home Care,Cleaning,,"Scotch Brite Sponge 20 cm X 17.5 cm, Pack of 6 U",,,h80.jpg,,Scotch,1
hom81,"Scotch Brite Scrub Pad Heavy Duty, 9 cm X 7.5 cm, Pack of 4 U",,120,,,,Home Care,Cleaning,,"Scotch Brite Scrub Pad Heavy Duty, 9 cm X 7.5 cm, Pack of 4 U",,,h81.jpg,,Scotch,1
hom82,"Scotch Brite Scrub Pad 10 cm X 14 cm, Pack of 6 U",,168,,,,Home Care,Cleaning,,"Scotch Brite Scrub Pad 10 cm X 14 cm, Pack of 6 U",,,h82.jpg,,Scotch,1
hom83,"Scotch Brite Scrub Pad 7.5cm X 10 cm, Pack of 12 U",,180,,,,Home Care,Cleaning,,"Scotch Brite Scrub Pad 7.5cm X 10 cm, Pack of 12 U",,,h83.jpg,,Scotch,1
hom84,"Britex Steel Scrubber 20 g, Pack of 12 U",,288,,,,Home Care,Cleaning,,"Britex Steel Scrubber 20 g, Pack of 12 U",,,h84.jpg,,Britex,1
hom85,Sabena Dishwash Bar 500 g,,32,,,,Home Care,Cleaning,,Sabena Dishwash Bar 500 g,,,h85.jpg,,Sabena,1
hom86,Sanifresh Toilet Cleaner 1 Litre,,108,,,,Home Care,Cleaning,,Sanifresh Toilet Cleaner 1 Litre,,,h86.jpg,,Sanifresh,1
hom87,Colin Glass Cleaner 250 ml,,45,,,,Home Care,Cleaning,,Colin Glass Cleaner 250 ml,,,h87.jpg,,Colin,1
hom88,Vim Dishwash Liquid 750 ml,,149,,,,Home Care,Cleaning,,Vim Dishwash Liquid 750 ml,,,h88.jpg,,Vim,1
hom89,Harpic Rim Block Lavender,,52,,,,Home Care,Cleaning,,Harpic Rim Block Lavender,,,h89.jpg,,Harpic,1
hom90,Vim Dish Wash Gel Pouch 500 ml,,91,,,,Home Care,Cleaning,,Vim Dish Wash Gel Pouch 500 ml,,,h90.jpg,,Vim,1
hom91,"Odopic Dishwash Bar 300 g, Pack of 3",,61,,,,Home Care,Cleaning,,"Odopic Dishwash Bar 300 g, Pack of 3",,,h91.jpg,,Odopic,1
hom92,Vim Dishwash Liquid 1.5 Litre,,280,,,,Home Care,Cleaning,,Vim Dishwash Liquid 1.5 Litre,,,h92.jpg,,Vim,1
hom93,"Harpic Toilet Cleaner Orange, 500 ml",,68,,,,Home Care,Cleaning,,"Harpic Toilet Cleaner Orange, 500 ml",,,h93.jpg,,Harpic,1
hom94,Harpic Cistern Block 100 g,,95,,,,Home Care,Cleaning,,Harpic Cistern Block 100 g,,,h94.jpg,,Harpic,1
hom95,"Harpic Toilet Cleaner Rose, 500 ml",,68,,,,Home Care,Cleaning,,"Harpic Toilet Cleaner Rose, 500 ml",,,h95.jpg,,Harpic,1
hom96,Harpic Toilet Cleaner 200 ml,,28,,,,Home Care,Cleaning,,Harpic Toilet Cleaner 200 ml,,,h96.jpg,,Harpic,1
hom97,"Harpic Toilet Cleaner Ultra, 500 ml",,74,,,,Home Care,Cleaning,,"Harpic Toilet Cleaner Ultra, 500 ml",,,h97.jpg,,Harpic,1
hom98,"Colin Glass Cleaner Ultra Trigger, 500 ml",,72,,,,Home Care,Cleaning,,"Colin Glass Cleaner Ultra Trigger, 500 ml",,,h98.jpg,,Colin,1
hom99,Vim Dish Wash Gel 500 ml,,105,,,,Home Care,Cleaning,,Vim Dish Wash Gel 500 ml,,,h99.jpg,,Vim,1
hom100,Harpic Toilet Cleaner 750 ml,,96,,,,Home Care,Cleaning,,Harpic Toilet Cleaner 750 ml,,,h100.jpg,,Harpic,1
hom101,Harpic Toilet Cleaner 500 ml,,68,,,,Home Care,Cleaning,,Harpic Toilet Cleaner 500 ml,,,h101.jpg,,Harpic,1
hom102,Harpic Toilet Cleaner 1 Litre,,125,,,,Home Care,Cleaning,,Harpic Toilet Cleaner 1 Litre,,,h102.jpg,,Harpic,1
hom103,Vim Dishwash Bar 320 g,,23,,,,Home Care,Cleaning,,Vim Dishwash Bar 320 g,,,h103.jpg,,Vim,1
hom104,Vim Dishwash Bar 40 U X 346 g,,960,,,,Home Care,Cleaning,,Vim Dishwash Bar 40 U X 346 g,,,h104.jpg,,Vim,1
hom105,Vim Dishwash Bar 80 U X 145 g,,900,,,,Home Care,Cleaning,,Vim Dishwash Bar 80 U X 145 g,,,h105.jpg,,Vim,1
hom106,Domex Disinfectant Floor Cleaner 500 ml,,68,,,,Home Care,Cleaning,,Domex Disinfectant Floor Cleaner 500 ml,,,h106.jpg,,Domex,1
hom107,Vim Dish Wash Gel 140 ml,,20,,,,Home Care,Cleaning,,Vim Dish Wash Gel 140 ml,,,h107.jpg,,Vim,1
hom108,Vim Dish Wash Gel 250 ml,,53,,,,Home Care,Cleaning,,Vim Dish Wash Gel 250 ml,,,h108.jpg,,Vim,1
hom109,"SaniFresh Toilet Cleaner 500ml, Buy 2 Get 1 Free",,136,,,,Home Care,Cleaning,,"SaniFresh Toilet Cleaner 500ml, Buy 2 Get 1 Free",,,h109.jpg,,Sanifresh,1
hom110,"Scotch Brite Wipe 7.5 cm X 10 cm, Pack of 5 with Scoopy",,75,,,,Home Care,Cleaning,,"Scotch Brite Wipe 7.5 cm X 10 cm, Pack of 5 with Scoopy",,,h110.jpg,,Scotch,1
hom111,Vim Dish Wash Bar 145 g,,10,,,,Home Care,Cleaning,,Vim Dish Wash Bar 145 g,,,h111.jpg,,Vim,1
hom112,Scotch Brite Gloves,,75,,,,Home Care,Cleaning,,Scotch Brite Gloves,,,h112.jpg,,Scotch,1
hom113,"Harpic Toilet Cleaner Thick, 500 ml",,68,,,,Home Care,Cleaning,,"Harpic Toilet Cleaner Thick, 500 ml",,,h115.jpg,,Harpic,1
hom114,Colin Kitchen Cleaner 400 ml,,75,,,,Home Care,Cleaning,,Colin Kitchen Cleaner 400 ml,,,h117.jpg,,Colin,1
hom115,Gebi Maha Laxmi Broom 1pc Pouch,,120,,,,Home Care,Cleaning,,Gebi Maha Laxmi Broom 1pc Pouch,,,h118.jpg,,Gebi,1
hom116,Gebi Smart Broom 1pc Pouch,,109,,,,Home Care,Cleaning,,Gebi Smart Broom 1pc Pouch,,,h119.jpg,,Gebi,1
hom117,Scotch Brite Cotton Mop Refill 1 Nos Pouch,,200,,,,Home Care,Cleaning,,Scotch Brite Cotton Mop Refill 1 Nos Pouch,,,h120.jpg,,Scotch,1
hom118,Odonil Gel 75 gm,,120,,,,Home Care,Air freshner,Room freshners,Odonil Gel 75 gm,,,h121.jpg,,Odonil,1
hom119,"Airwick Gel Everfresh, 50 g",,100,,,,Home Care,Air freshner,Room freshners,"Airwick Gel Everfresh, 50 g",,,h122.jpg,,Airwick,1
hom120,"Airwick Fresh Matic Refill Sandal, 250 ml",,249,,,,Home Care,Air freshner,Room freshners,"Airwick Fresh Matic Refill Sandal, 250 ml",,,h123.jpg,,Airwick,1
hom121,"Odonil One Touch Manual Diffuser Natural Starter, 12 ml",,99,,,,Home Care,Air freshner,Room freshners,"Odonil One Touch Manual Diffuser Natural Starter, 12 ml",,,h124.jpg,,Odonil,1
hom122,"Odonil One Touch Manual Diffuser Floral Starter,12 ml",,99,,,,Home Care,Air freshner,Room freshners,"Odonil One Touch Manual Diffuser Floral Starter,12 ml",,,h125.jpg,,Odonil,1
hom123,"Glade Sensations Automatic Diffuser Morning Freshness,12 ml",,225,,,,Home Care,Air freshner,Room freshners,"Glade Sensations Automatic Diffuser Morning Freshness,12 ml",,,h126.jpg,,Glade,1
hom124,"Airwick Fresh Matic Refill Rose, 250 ml",,249,,,,Home Care,Air freshner,Room freshners,"Airwick Fresh Matic Refill Rose, 250 ml",,,h127.jpg,,Airwick,1
hom125,"Glade Aerosol Lavender, 300 ml",,120,,,,Home Care,Air freshner,Room freshners,"Glade Aerosol Lavender, 300 ml",,,h128.jpg,,Glade,1
hom126,"Airwick Aroma Automatic Diffuser Rose, 18 ml",,199,,,,Home Care,Air freshner,Room freshners,"Airwick Aroma Automatic Diffuser Rose, 18 ml",,,h129.jpg,,Airwick,1
hom127,"Airwick Aroma Automatic Diffuser Lavender, 18 ml",,199,,,,Home Care,Air freshner,Room freshners,"Airwick Aroma Automatic Diffuser Lavender, 18 ml",,,h130.jpg,,Airwick,1
hom128,Glade Gel Floral 70 g,,65,,,,Home Care,Air freshner,Room freshners,Glade Gel Floral 70 g,,,h131.jpg,,Glade,1
hom129,"Ambipur Manual Diffuser Spring & Renewal, 275 g",,250,,,,Home Care,Air freshner,Room freshners,"Ambipur Manual Diffuser Spring & Renewal, 275 g",,,h132.jpg,,Airwick,1
hom130,Ambipur Spray 275 g,,250,,,,Home Care,Air freshner,Room freshners,Ambipur Spray 275 g,,,h133.jpg,,Ambipur,1
hom131,"Airwick Fresh Matic Refill Lavender Dew, 250 ml",,249,,,,Home Care,Air freshner,Room freshners,"Airwick Fresh Matic Refill Lavender Dew, 250 ml",,,h134.jpg,,Airwick,1
hom132,"Odonil Aerosol Jasmine Fresh, 300 ml",,130,,,,Home Care,Air freshner,Room freshners,"Odonil Aerosol Jasmine Fresh, 300 ml",,,h135.jpg,,Odonil,1
hom133,"Glade Touch & Fresh Refill Lavender, 12 ml",,75,,,,Home Care,Air freshner,Room freshners,"Glade Touch & Fresh Refill Lavender, 12 ml",,,h136.jpg,,Glade,1
hom134,"Airwick Aerosol Lavender, 300 m",,120,,,,Home Care,Air freshner,Room freshners,"Airwick Aerosol Lavender, 300 m",,,h137.jpg,,Airwick,1
hom135,"Airwick Aerosol Lemon Garden, 300 ml",,120,,,,Home Care,Air freshner,Room freshners,"Airwick Aerosol Lemon Garden, 300 ml",,,h138.jpg,,Airwick,1
hom136,"Airwick Aerosol Rose, 300 ml",,120,,,,Home Care,Air freshner,Room freshners,"Airwick Aerosol Rose, 300 ml",,,h139.jpg,,Airwick,1
hom137,"Airwick Fresh Matic Automatic Diffuser Rose, 18 ml",,441,,,,Home Care,Air freshner,Room freshners,"Airwick Fresh Matic Automatic Diffuser Rose, 18 ml",,,h140.jpg,,Airwick,1
hom138,"Airwick Fresh Matic Automatic Diffuser Lavender Dew, 18 m",,449,,,,Home Care,Air freshner,Room freshners,"Airwick Fresh Matic Automatic Diffuser Lavender Dew, 18 m",,,h141.jpg,,Airwick,1
hom139,"Ambipur Aerosol Pink Flower, 300 ml",,140,,,,Home Care,Air freshner,Room freshners,"Ambipur Aerosol Pink Flower, 300 ml",,,h144.jpg,,Ambipur,1
hom140,"Glade Touch & Fresh Manual Diffuser Lemon, 12 ml",,90,,,,Home Care,Air freshner,Room freshners,"Glade Touch & Fresh Manual Diffuser Lemon, 12 ml",,,h145.jpg,,Glade,1
hom141,"Airwick Gel Lavneder, 50 g",,55,,,,Home Care,Air freshner,Room freshners,"Airwick Gel Lavneder, 50 g",,,h146.jpg,,Airwick,1
hom142,"Airwick Gel Lemon, 50 g",,55,,,,Home Care,Air freshner,Room freshners,"Airwick Gel Lemon, 50 g",,,h147.jpg,,Airwick,1
hom143,"Airwick Gel Rose, 50 g",,55,,,,Home Care,Air freshner,Room freshners,"Airwick Gel Rose, 50 g",,,h148.jpg,,Airwick,1
hom144,Swarna Lavender Agarbatti 90 g,,55,,,,Home Care,Air freshner,Room freshners,Swarna Lavender Agarbatti 90 g,,,h149.jpg,,Swarna,1
hom145,Swarnachampa Agarbatti 90 g,,55,,,,Home Care,Air freshner,Room freshners,Swarnachampa Agarbatti 90 g,,,h150.jpg,,Swarna,1
hom146,Glade Air Freshener Automatic,,200,,,,Home Care,Air freshner,Room freshners,Glade Air Freshener Automatic,,,h151.jpg,,Glade,1
hom147,Glade Touch & Fresh 12 ml,,99,,,,Home Care,Air freshner,Room freshners,Glade Touch & Fresh 12 ml,,,h153.jpg,,Glade,1
hom148,"Odonil One Touch Refill Natural Refill,12 ml",,75,,,,Home Care,Air freshner,Room freshners,"Odonil One Touch Refill Natural Refill,12 ml",,,h154.jpg,,Odonil,1
hom149,"Odonil One Touch Refill Floral Refill,12 ml",,75,,,,Home Care,Air freshner,Room freshners,"Odonil One Touch Refill Floral Refill,12 ml",,,h155.jpg,,Odonil,1
hom150,"Glade Gel Clean Linen, 70 g",,65,,,,Home Care,Air freshner,Room freshners,"Glade Gel Clean Linen, 70 g",,,h156.jpg,,Glade,1
hom151,"Airwick Aerosol Aqua Lavender, 345 ml",,149,,,,Home Care,Air freshner,Room freshners,"Airwick Aerosol Aqua Lavender, 345 ml",,,h157.jpg,,Airwick,1
hom152,"Airwick Aerosol Aqua Jasmine, 345 ml",,149,,,,Home Care,Air freshner,Room freshners,"Airwick Aerosol Aqua Jasmine, 345 ml",,,h158.jpg,,Airwick,1
hom153,"Odonil Gel Jasmine, 75 g",,71,,,,Home Care,Air freshner,Room freshners,"Odonil Gel Jasmine, 75 g",,,h159.jpg,,Odonil,1
hom154,"Glade Touch & Fresh Starter Kit Clean Air, 12 ml",,90,,,,Home Care,Air freshner,Room freshners,"Glade Touch & Fresh Starter Kit Clean Air, 12 ml",,,h160.jpg,,Glade,1
hom155,Airwick Aroma Refill Rose,,139,,,,Home Care,Air freshner,Room freshners,Airwick Aroma Refill Rose,,,h161.jpg,,Airwick,1
hom156,Airwick Aroma Refill Lavender,,139,,,,Home Care,Air freshner,Room freshners,Airwick Aroma Refill Lavender,,,h162.jpg,,Airwick,1
hom157,"Glade Aerosol Floral Perfect, 320 ml",,115,,,,Home Care,Air freshner,Room freshners,"Glade Aerosol Floral Perfect, 320 ml",,,h163.jpg,,Glade,1
hom158,"Odonil Aerosol Sandal, 300 ml",,130,,,,Home Care,Air freshner,Room freshners,"Odonil Aerosol Sandal, 300 ml",,,h164.jpg,,Odonil,1
hom159,"Odonil Aerosol Rose, 300 ml",,130,,,,Home Care,Air freshner,Room freshners,"Odonil Aerosol Rose, 300 ml",,,h165.jpg,,Odonil,1
hom160,"Odonil Gel Rose, 75 g",,75,,,,Home Care,Air freshner,Room freshners,"Odonil Gel Rose, 75 g",,,h166.jpg,,Odonil,1
hom161,"Odonil Gel Lavender, 75 g",,71,,,,Home Care,Air freshner,Room freshners,"Odonil Gel Lavender, 75 g",,,h167.jpg,,Odonil,1
hom162,Swarnachandan Agarbatti Pack of 12 X 20 g,,180,,,,Home Care,Air freshner,Room freshners,Swarnachandan Agarbatti Pack of 12 X 20 g,,,h168.jpg,,Swarna,1
hom163,Swarnachampa Agarbatti Pack of 12 X 25 g each,,180,,,,Home Care,Air freshner,Room freshners,Swarnachampa Agarbatti Pack of 12 X 25 g each,,,h169.jpg,,Swarna,1
hom164,Swarnachandan Agarbatti 70 g,,55,,,,Home Care,Air freshner,Room freshners,Swarnachandan Agarbatti 70 g,,,h170.jpg,,Swarna,1
hom165,"Taski Air Freshener R5, 5 Litres",,840,,,,Home Care,Air freshner,Room freshners,"Taski Air Freshener R5, 5 Litres",,,h171.jpg,,Taski,1
hom166,Odonil Air Freshener Blocks 100 g,,144,,,,Home Care,Air freshner,Sanitary Cubes,Odonil Air Freshener Blocks 100 g,,,h172.jpg,,Odonil,1
hom167,Odonil Jasmine Blocks 75 g,,162,,,,Home Care,Air freshner,Sanitary Cubes,Odonil Jasmine Blocks 75 g,,,h173.jpg,,Odonil,1
hom168,"Odonil Blocks Buy 3 And Get 1 Free, 50 g",,114,,,,Home Care,Air freshner,Sanitary Cubes,"Odonil Blocks Buy 3 And Get 1 Free, 50 g",,,h174.jpg,,Odonil,1
hom169,"Odonil Blocks Mystic Rose, 75 g",,54,,,,Home Care,Air freshner,Sanitary Cubes,"Odonil Blocks Mystic Rose, 75 g",,,h175.jpg,,Odonil,1
hom170,"Odonil Blocks Jasmine, 75 g",,54,,,,Home Care,Air freshner,Sanitary Cubes,"Odonil Blocks Jasmine, 75 g",,,h176.jpg,,Odonil,1
hom171,"Odonil Blocks Lavender, 50 g",,38,,,,Home Care,Air freshner,Sanitary Cubes,"Odonil Blocks Lavender, 50 g",,,h177.jpg,,Odonil,1
hom172,"Odonil Blocks Full House, 50 g",,140,,,,Home Care,Air freshner,Sanitary Cubes,"Odonil Blocks Full House, 50 g",,,h178.jpg,,Odonil,1
hom173,Odonil Air Freshener Lavender 75gm Pack,,56,,,,Home Care,Air freshner,Sanitary Cubes,Odonil Air Freshener Lavender 75gm Pack,,,h179.jpg,,Odonil,1
hom174,Odonil Air Freshener Jasmine Mist 75gm,,56,,,,Home Care,Air freshner,Sanitary Cubes,Odonil Air Freshener Jasmine Mist 75gm,,,h180.jpg,,Odonil,1
hom175,Glade Air freshener Touch and Fresh,,75,,,,Home Care,Air freshner,Sanitary Cubes,Glade Air freshener Touch and Fresh,,,h181.jpg,,Glade,1
hom176,Glade Air Refreshener Refreshing Citrusn,,199,,,,Home Care,Air freshner,Sanitary Cubes,Glade Air Refreshener Refreshing Citrusn,,,h182.jpg,,Glade,1
hom177,Odonil Orchid Dew Air Freshner 75 gm,,54,,,,Home Care,Air freshner,Sanitary Cubes,Odonil Orchid Dew Air Freshner 75 gm,,,h183.jpg,,Odonil,1
hom178,Ambi Pur Air Effects Newzealand Springs,,240,,,,Home Care,Air freshner,Sanitary Cubes,Ambi Pur Air Effects Newzealand Springs,,,h184.jpg,,Ambi,1
hom179,Air Wick Air Freshner Spray Aqua Floral,,130,,,,Home Care,Air freshner,Sanitary Cubes,Air Wick Air Freshner Spray Aqua Floral,,,h185.jpg,,Airwick,1
hom180,Air Wick Air Fabric Cool Linen ,,149,,,,Home Care,Air freshner,Sanitary Cubes,Air Wick Air Fabric Cool Linen ,,,h186.jpg,,Airwick,1
hom181,Air Wick Air Freshener Spray Velvet Rose,,120,,,,Home Care,Air freshner,Sanitary Cubes,Air Wick Air Freshener Spray Velvet Rose,,,h187.jpg,,Airwick,1
hom182,Ambi Pur Air Effects Sweet Citrus&Zest,,240,,,,Home Care,Air freshner,Sanitary Cubes,Ambi Pur Air Effects Sweet Citrus&Zest,,,h188.jpg,,Ambi ,1
hom183,Ambi Pur Air Effects Springs&Renewal,,240,,,,Home Care,Air freshner,Sanitary Cubes,Ambi Pur Air Effects Springs&Renewal,,,h189.jpg,,Ambi ,1
hom184,Ambi Pur Air Effects Lavender Vanilla ,,240,,,,Home Care,Air freshner,Sanitary Cubes,Ambi Pur Air Effects Lavender Vanilla ,,,h190.jpg,,Ambi ,1
hom185, Ambi Pur Air Effects Blossom and Breeze,,240,,,,Home Care,Air freshner,Sanitary Cubes, Ambi Pur Air Effects Blossom and Breeze,,,h191.jpg,,Ambi ,1
hom186,Ambi Pur Car Air Freshner Aqua Refill 7 ,,175,,,,Home Care,Air freshner,Sanitary Cubes,Ambi Pur Car Air Freshner Aqua Refill 7 ,,,h192.jpg,,Ambi ,1
hom187,Ambika Pur Car Air Freshener Aqua2x7ml ,,375,,,,Home Care,Air freshner,Sanitary Cubes,Ambika Pur Car Air Freshener Aqua2x7ml ,,,h193.jpg,,Ambika,1
hom188,Air Wick Freshmatic Automatic Spray Velv,,499,,,,Home Care,Air freshner,Sanitary Cubes,Air Wick Freshmatic Automatic Spray Velv,,,h194.jpg,,Airwick,1
hom189,Ambica Durbar Bathi 150 g,,372,,,,Home Care,Religious Needs,,Ambica Durbar Bathi 150 g,,,h195.jpg,,Ambika,1
hom190,Ambica Mahalakshmi Dhoop Pack of 12 U X 60 g,,192,,,,Home Care,Religious Needs,,Ambica Mahalakshmi Dhoop Pack of 12 U X 60 g,,,h196.jpg,,Ambika,1
hom191,"Ambica Dhoop Athisaya, 12 Cones",,50,,,,Home Care,Religious Needs,,"Ambica Dhoop Athisaya, 12 Cones",,,h197.jpg,,Ambika,1
hom192,"Mangaldeep Agarbatti Silver, 80 U",,60,,,,Home Care,Religious Needs,,"Mangaldeep Agarbatti Silver, 80 U",,,h198.jpg,,Mangaldeep,1
hom193,"Mangaldeep Agarbatti Durbar Gold, 90 U",,33,,,,Home Care,Religious Needs,,"Mangaldeep Agarbatti Durbar Gold, 90 U",,,h199.jpg,,Mangaldeep,1
