"product_id","name","price","d_price","w_price","search_keyword",
"5111","Bella Baby Happy Diapers S{3-8kg} 30 Nos Pouch","426","0","0","Bella Baby Happy Diapers S{3-8kg} 30 Nos Pouch,baby care,baby care,diapers&wipes",
"5113","Chicco Salviettine Detergenti Soft Cleansing Baby Wipes 72 Sheets Pouch","219","0","0","Chicco Salviettine Detergenti Soft Cleansing Baby Wipes 72 Sheets Pouch,,baby care,diapers&wipes",
"5114","Himalaya Baby Wipes 24 Nos Pouch","75","0","0","Himalaya Baby Wipes 24 Nos Pouch,,baby care,diapers&wipes",
"5115","Himalaya Gentle Baby Wipes 72 Nos Pouch","165","0","0","Himalaya Gentle Baby Wipes 72 Nos Pouch,,baby care,diapers&wipes",
"5116","Huggies Diapers Total Protection  48 Nos","790","0","0","Huggies Diapers Total Protection  48 Nos,,baby care,diapers&wipes",
"5120","Huggies Diapers Total Protection M edium 40 Nos","565","0","0","Huggies Diapers Total Protection M edium 40 Nos,,baby care,diapers&wipes",
"5121","Huggies Dry Diapers Large 56 Nos","740","0","0","Huggies Dry Diapers Large 56 Nos,,baby care,diapers&wipes",
"5123","Huggies Care Diapers Large, 5 U","70","0","0","Huggies Care Diapers Large, 5 U,,baby care,diapers&wipes",
"5124","Huggies Care Diapers Large, 7 U","110","0","0","Huggies Care Diapers Large, 7 U,,baby care,diapers&wipes",
"5125","Huggies Care Diapers Large, Pack Of 6 X 2 U","174","0","0","Huggies Care Diapers Large, Pack Of 6 X 2 U,,baby care,diapers&wipes",
"5126","Huggies Care Diapers Medium, 30 U","355","0","0","Huggies Care Diapers Medium, 30 U,,baby care,diapers&wipes",
"5127","Huggies Dry Diapers Medium  62 U","710","0","0","Huggies Dry Diapers Medium  62 U,,baby care,diapers&wipes",
"5128","Huggies Dry Diapers Medium  18 U","220","0","0","Huggies Dry Diapers Medium  18 U,,baby care,diapers&wipes",
"5129","Huggies Dry Diapers Medium  30 U","355","0","0","Huggies Dry Diapers Medium  30 U,,baby care,diapers&wipes",
"5130","Huggies Care Diapers Medium, 5 U","65","0","0","Huggies Care Diapers Medium, 5 U,,baby care,diapers&wipes",
"5131","Huggies Care Diapers Medium, 9 U","115","0","0","Huggies Care Diapers Medium, 9 U,,baby care,diapers&wipes",
"5132","Huggies Care Diapers Medium, Pack Of 6 X 2 U","168","0","0","Huggies Care Diapers Medium, Pack Of 6 X 2 U,,baby care,diapers&wipes",
"5133","Huggies Dry Dipers Small 30 Nos","270","0","0","Huggies Dry Dipers Small 30 Nos,,baby care,diapers&wipes",
"5134","Huggies Dry Dipers Small 10 Nos","100","0","0","Huggies Dry Dipers Small 10 Nos,,baby care,diapers&wipes",
"5135","Huggies Care Diapers Small, 5 U","52","0","0","Huggies Care Diapers Small, 5 U,,baby care,diapers&wipes",
"5136","Huggies Care Diapers Small, Pack Of 6 X 2 U","126","0","0","Huggies Care Diapers Small, Pack Of 6 X 2 U,,baby care,diapers&wipes",
"5137","Huggies Wonder Pants Large, Pack of 6 X 2s","174","0","0","Huggies Wonder Pants Large, Pack of 6 X 2s,,baby care,diapers&wipes",
"5138","Huggies Diapers Wonder Pants Medium  44 Nos Pouch","525","0","0","Huggies Diapers Wonder Pants Medium  44 Nos Pouch,,baby care,diapers&wipes",
"5139","Huggies Wonder Pants Medium, 20 U","240","0","0","Huggies Wonder Pants Medium, 20 U,,baby care,diapers&wipes",
"5140","Huggies Wonder Pants Medium, Pack of 6 X 2s","156","0","0","Huggies Wonder Pants Medium, Pack of 6 X 2s,,baby care,diapers&wipes",
"5141","Huggies Diapers New Baby 24 Pouch ","315","0","0","Huggies Diapers New Baby 24 Pouch ,,baby care,diapers&wipes",
"5142","Huggies Wonder Pants XL 16 Pouch","285","0","0","Huggies Wonder Pants XL 16 Pouch,,baby care,diapers&wipes",
"5143","Huggies Diapers Total Protection XL 46 Nos","750","0","0","Huggies Diapers Total Protection XL 46 Nos,,baby care,diapers&wipes",
"5144","Johnson & Johnson Baby Nappy Pads 20 Nos Pouch","145","0","0","Johnson & Johnson Baby Nappy Pads 20 Nos Pouch,,baby care,diapers&wipes",
"5145","Johnson 7 Johnson Baby Skin Care Wipes 2X80 Nos Pouch","380","0","0","Johnson 7 Johnson Baby Skin Care Wipes 2X80 Nos Pouch,,baby care,diapers&wipes",
"5146","Johnsons Baby Wipes Skin Care, 80 U","220","0","0","Johnsons Baby Wipes Skin Care, 80 U,,baby care,diapers&wipes",
"5147","Mamy Poko Baby Wipes 52 Wipes","99","0","0","Mamy Poko Baby Wipes 52 Wipes,,baby care,diapers&wipes",
"5148","Mamy Poko Pants Large, 20 U","265","0","0","Mamy Poko Pants Large, 20 U,,baby care,diapers&wipes",
"5149","Mamy Poko Pants Large, 56 U","699","0","0","Mamy Poko Pants Large, 56 U,,baby care,diapers&wipes",
"5150","Mamy Poko Pants Large, Pack Of 6 X 1 U","84","0","0","Mamy Poko Pants Large, Pack Of 6 X 1 U,,baby care,diapers&wipes",
"5151","Mamy Poko Pants Medium, 20 U","235","0","0","Mamy Poko Pants Medium, 20 U,,baby care,diapers&wipes",
"5152","Mamy Poko Pants Medium, 38 U","499","0","0","Mamy Poko Pants Medium, 38 U,,baby care,diapers&wipes",
"5153","Mamy Poko Pants Medium, 44 U","499","0","0","Mamy Poko Pants Medium, 44 U,,baby care,diapers&wipes",
"5154","Mamy Poko Pants Medium, 60 U","699","0","0","Mamy Poko Pants Medium, 60 U,,baby care,diapers&wipes",
"5155","Mamy Poko Pants Medium, Pack Of 6 X 1 U","78","0","0","Mamy Poko Pants Medium, Pack Of 6 X 1 U,,baby care,diapers&wipes",
"5156","Mamy Poko Pants Small, 18 U","195","0","0","Mamy Poko Pants Small, 18 U,,baby care,diapers&wipes",
"5157","Mamy Poko Pants Small, 48 U","499","0","0","Mamy Poko Pants Small, 48 U,,baby care,diapers&wipes",
"5158","Mamy Poko Pants Small, 9 U","99","0","0","Mamy Poko Pants Small, 9 U,,baby care,diapers&wipes",
"5159","Mamy Poko Pants Standard Large, 34 U","399","0","0","Mamy Poko Pants Standard Large, 34 U,,baby care,diapers&wipes",
"5160","Mamy Poko Pants Standard Large, Pack Of 4 X 1 U","72","0","0","Mamy Poko Pants Standard Large, Pack Of 4 X 1 U,,baby care,diapers&wipes",
"5161","Mamy Poko Pants Standard Medium, 36 U","399","0","0","Mamy Poko Pants Standard Medium, 36 U,,baby care,diapers&wipes",
"5162","Mamy Poko Pants Standard Medium, Pack Of 4 X 1 U","66","0","0","Mamy Poko Pants Standard Medium, Pack Of 4 X 1 U,,baby care,diapers&wipes",
"5163","Mamy Poko Pants Standard Medium, Pack Of 5 X 1 U","55","0","0","Mamy Poko Pants Standard Medium, Pack Of 5 X 1 U,,baby care,diapers&wipes",
"5164","Mamy Poko Pants Standard Small, 5 U","45","0","0","Mamy Poko Pants Standard Small, 5 U,,baby care,diapers&wipes",
"5165","Mamy Poko Pants XL , 32 U","499","0","0","Mamy Poko Pants XL , 32 U,,baby care,diapers&wipes",
"5166","Mamy Poko Pants XL, 46 U","699","0","0","Mamy Poko Pants XL, 46 U,,baby care,diapers&wipes",
"5167","Mamy Poko Pants XS, Pack of 6 X 10 U each","60","0","0","Mamy Poko Pants XS, Pack of 6 X 10 U each,,baby care,diapers&wipes",
"5168","Mamy Poko Pants XXL , 24 U","499","0","0","Mamy Poko Pants XXL , 24 U,,baby care,diapers&wipes",
"5169","Pampers Active Baby Diapers Large, 72 s, 6 Pads Free","1330","0","0","Pampers Active Baby Diapers Large, 72 s, 6 Pads Free,,baby care,diapers&wipes",
"5170","Pampers Active Baby Diapers XL, 52s, 4 Pads Free","1270","0","0","Pampers Active Baby Diapers XL, 52s, 4 Pads Free,,baby care,diapers&wipes",
"5171","Pampers Active Baby Pants Large, 36 U","490","0","0","Pampers Active Baby Pants Large, 36 U,,baby care,diapers&wipes",
"5172","Pampers baby wipes Natural clean, 72 U","219","0","0","Pampers baby wipes Natural clean, 72 U,,baby care,diapers&wipes",
"5173","Pampers baby wipes Natural clean, 72 U","65","0","0","Pampers baby wipes Natural clean, 72 U,,baby care,diapers&wipes",
"5174","Pampers Diapers Active Baby Large, 50 U","870","0","0","Pampers Diapers Active Baby Large, 50 U,,baby care,diapers&wipes",
"5175","Pampers Diapers Active Baby Medium, 62 U","950","0","0","Pampers Diapers Active Baby Medium, 62 U,,baby care,diapers&wipes",
"5176","Pampers Diapers Large, 18 U","245","0","0","Pampers Diapers Large, 18 U,,baby care,diapers&wipes",
"5177","Pampers Diapers Large, 38 U","510","0","0","Pampers Diapers Large, 38 U,,baby care,diapers&wipes",
"5178","Pampers Diapers Large, 5 U","70","0","0","Pampers Diapers Large, 5 U,,baby care,diapers&wipes",
"5179","Pampers Diapers Large, 60 U","799","0","0","Pampers Diapers Large, 60 U,,baby care,diapers&wipes",
"5180","Pampers Diapers Large, 9 U","125","0","0","Pampers Diapers Large, 9 U,,baby care,diapers&wipes",
"5181","Pampers Diapers Large, Pack Of 6 X 2 U","174","0","0","Pampers Diapers Large, Pack Of 6 X 2 U,,baby care,diapers&wipes",
"5182","Pampers Diapers Medium, 10 U","126","0","0","Pampers Diapers Medium, 10 U,,baby care,diapers&wipes",
"5183","Pampers Diapers Medium,Active Baby  20 U","320","0","0","Pampers Diapers Medium,Active Baby  20 U,,baby care,diapers&wipes",
"5184","Pampers Diapers Medium, 20 U","245","0","0","Pampers Diapers Medium, 20 U,,baby care,diapers&wipes",
"5185","Pampers Diapers Medium, 42 U","505","0","0","Pampers Diapers Medium, 42 U,,baby care,diapers&wipes",
"5186","Pampers Diapers Medium, 66 U","780","0","0","Pampers Diapers Medium, 66 U,,baby care,diapers&wipes",
"5187","Pampers Diapers Medium, Pack Of 3 X 5 U","65","0","0","Pampers Diapers Medium, Pack Of 3 X 5 U,,baby care,diapers&wipes",
"5188","Pampers Diapers Medium, Pack Of 6 X 2 U","162","0","0","Pampers Diapers Medium, Pack Of 6 X 2 U,,baby care,diapers&wipes",
"5189","Pampers Diapers New Baby, Small, 22 U","299","0","0","Pampers Diapers New Baby, Small, 22 U,,baby care,diapers&wipes",
"5190","Pampers Diapers Small, 11 U","120","0","0","Pampers Diapers Small, 11 U,,baby care,diapers&wipes",
"5191","Pampers Diapers Small, 5 U","55","0","0","Pampers Diapers Small, 5 U,,baby care,diapers&wipes",
"5192","Pampers Diapers Small, Pack Of 6 X 2 U","132","0","0","Pampers Diapers Small, Pack Of 6 X 2 U,,baby care,diapers&wipes",
"5193","Pampers Pants Active Baby, Large, 52 U","690","0","0","Pampers Pants Active Baby, Large, 52 U,,baby care,diapers&wipes",
"5194","Pampers Pants Medium , 42 U","490","0","0","Pampers Pants Medium , 42 U,,baby care,diapers&wipes",
"5195","Pampers Pants Medium, 6 U","690","0","0","Pampers Pants Medium, 6 U,,baby care,diapers&wipes",
"5196","Huggies  Wonder Pants Small 18 Nos","195","0","0","Huggies  Wonder Pants Small 18 Nos,,baby care,diapers&wipes",
"5197","Huggies Wonder Pants Medium  60 Nos","699","0","0","Huggies Wonder Pants Medium  60 Nos,,baby care,diapers&wipes",
"5198","Huggies Wonder Pants Large  38 Nos","530","0","0","Huggies Wonder Pants Large  38 Nos,,baby care,diapers&wipes",
"5199","Huggies Dipers Total Protection Small 46 Nos","560","0","0","Huggies Dipers Total Protection Small 46 Nos,,baby care,diapers&wipes",
"5200","Huggies Dipers Total Protection Small 26 Nos","320","0","0","Huggies Dipers Total Protection Small 26 Nos,,baby care,diapers&wipes",
"5201","Huggies Diapers Total Protection Medium 58 Nos","840","0","0","Huggies Diapers Total Protection Medium 58 Nos,,baby care,diapers&wipes",
"5202","Huggies Wonder Pants Small 48 Nos Pouch","540","0","0","Huggies Wonder Pants Small 48 Nos Pouch,,baby care,diapers&wipes",
"5203","Huggies Dry Dipers Large 16 Nos","220","0","0","Huggies Dry Dipers Large 16 Nos,,baby care,diapers&wipes",
"5204","Huggies Wonder Pants Medium 20 Pants Poush","240","0","0","Huggies Wonder Pants Medium 20 Pants Poush,,baby care,diapers&wipes",
"5205","Huggies Dru  Dipers Large 16 Nos Pouch","220","0","0","Huggies Dru  Dipers Large 16 Nos Pouch,,baby care,diapers&wipes",
"5206","Huggies Wonder Pants 20 Nos","265","0","0","Huggies Wonder Pants 20 Nos,,baby care,diapers&wipes",
"5207","Cerelac Baby Food Wheat Orange, Stage 2, 300 g","190","0","0","Cerelac Baby Food Wheat Orange, Stage 2, 300 g,,baby care,feeding&baby food",
"5208","Cerelac Baby Food Wheat Honey, Stage 2, 300 g","190","0","0","Cerelac Baby Food Wheat Honey, Stage 2, 300 g,,baby care,feeding&baby food",
"5209","Cerelac Baby Food Dal Veg Stage 4, 300 g","205","0","0","Cerelac Baby Food Dal Veg Stage 4, 300 g,,baby care,feeding&baby food",
"5210","Cerelac Baby Food Wheat, Stage 1, 300 g","155","0","0","Cerelac Baby Food Wheat, Stage 1, 300 g,,baby care,feeding&baby food",
"5211","Cerelac Baby Food Wheat Apple, Stage 1, 300 g","165","0","0","Cerelac Baby Food Wheat Apple, Stage 1, 300 g,,baby care,feeding&baby food",
"5212","Cerelac Baby Food Wheat Apple Cherry, Stage 2, 300 g","184","0","0","Cerelac Baby Food Wheat Apple Cherry, Stage 2, 300 g,,baby care,feeding&baby food",
"5213","Cerelac Baby Food Mixed Veg, Stage 3, 300 g","198","0","0","Cerelac Baby Food Mixed Veg, Stage 3, 300 g,,baby care,feeding&baby food",
"5214","Cerelac Baby Food MixedFruit, Stage 3, 300 g","198","0","0","Cerelac Baby Food MixedFruit, Stage 3, 300 g,,baby care,feeding&baby food",
"5215","Manna First Baby Food Dates Rich {bonnie Babies For}400Gm Carton","260","0","0","Manna First Baby Food Dates Rich {bonnie Babies For}400Gm Carton,,baby care,feeding&baby food",
"5216","MannaFirst Baby Food Banana Rich {Bonnie Babies}400 gm Carton","220","0","0","MannaFirst Baby Food Banana Rich {Bonnie Babies}400 gm Carton,,baby care,feeding&baby food",
"5217","Cerelac Wheat Orange Stage 2  Carton 300 gm Carton","190","0","0","Cerelac Wheat Orange Stage 2  Carton 300 gm Carton,,baby care,feeding&baby food",
"5218","Nestle Nestum Rice Dal  Vegetable Stage 2 300gm Carton","128","0","0","Nestle Nestum Rice Dal  Vegetable Stage 2 300gm Carton,,baby care,feeding&baby food",
"5219","Similac Baby Milk Advance 2, 400 g","495","0","0","Similac Baby Milk Advance 2, 400 g,,baby care,feeding&baby food",
"5220","Similac Baby Milk Advance 1, 400 g","495","0","0","Similac Baby Milk Advance 1, 400 g,,baby care,feeding&baby food",
"5221","Nan Pro Baby Milk 400 g Stage 1","490","0","0","Nan Pro Baby Milk 400 g Stage 1,,baby care,feeding&baby food",
"5222","Nan Pro Baby Milk 400 g Stage 2","465","0","0","Nan Pro Baby Milk 400 g Stage 2,,baby care,feeding&baby food",
"5223","Nan Pro Baby Milk Stage 3, 400 g","460","0","0","Nan Pro Baby Milk Stage 3, 400 g,,baby care,feeding&baby food",
"5224","Lactogen Baby Milk Stage 2, 400 g","270","0","0","Lactogen Baby Milk Stage 2, 400 g,,baby care,feeding&baby food",
"5225","Lactogen Baby Milk Stage 1, 400 g","276","0","0","Lactogen Baby Milk Stage 1, 400 g,,baby care,feeding&baby food",
"5226","Lactogen Baby Milk Stage 3, 400 g","263","0","0","Lactogen Baby Milk Stage 3, 400 g,,baby care,feeding&baby food",
"5227","Amul Spray, Infant Milk Food Tin, 500 g","185","0","0","Amul Spray, Infant Milk Food Tin, 500 g,,baby care,feeding&baby food",
"5228","Amul Spray, Infant Milk Food Pouch, 1 Kg","340","0","0","Amul Spray, Infant Milk Food Pouch, 1 Kg,,baby care,feeding&baby food",
"5229","Nestle Nan 4 400gm Carton","455","0","0","Nestle Nan 4 400gm Carton,,baby care,feeding&baby food",
"5230","Nestle Lactogen 4 400gm Carton","256","0","0","Nestle Lactogen 4 400gm Carton,,baby care,feeding&baby food",
"5231","Chicco Baby Soap 125 g","95","0","0","Chicco Baby Soap 125 g,,baby care,bath&skin",
"5232","Chicco Baby Soap 75 g","65","0","0","Chicco Baby Soap 75 g,,baby care,bath&skin",
"5233","Chicco Shampoo No Tears, 200 ml","199","0","0","Chicco Shampoo No Tears, 200 ml,,baby care,bath&skin",
"5234","Chicco Shampoo No Tears, 500 ml","399","0","0","Chicco Shampoo No Tears, 500 ml,,baby care,bath&skin",
"5235","Johnsons Baby Bath Top to Toe, 200 ml","130","0","0","Johnsons Baby Bath Top to Toe, 200 ml,,baby care,bath&skin",
"5236","Johnsons Baby Shampoo No More Tears, 100 ml","80","0","0","Johnsons Baby Shampoo No More Tears, 100 ml,,baby care,bath&skin",
"5237","Johnsons Baby Shampoo No More Tears, 200 ml","150","0","0","Johnsons Baby Shampoo No More Tears, 200 ml,,baby care,bath&skin",
"5238","Johnsons Baby Shampoo No More Tears, 200 ml","150","0","0","Johnsons Baby Shampoo No More Tears, 200 ml,,baby care,bath&skin",
"5239","Johnsons Baby Shampoo No More Tears, 475 ml","310","0","0","Johnsons Baby Shampoo No More Tears, 475 ml,,baby care,bath&skin",
"5240","Johnsons Baby Shampoo No More Tears, 60 ml","50","0","0","Johnsons Baby Shampoo No More Tears, 60 ml,,baby care,bath&skin",
"5241","Johnsons Baby Soap 100 g","55","0","0","Johnsons Baby Soap 100 g,,baby care,bath&skin",
"5242","Johnsons Baby Soap 150 g","75","0","0","Johnsons Baby Soap 150 g,,baby care,bath&skin",
"5243","Johnsons Baby Soap 50 g","27","0","0","Johnsons Baby Soap 50 g,,baby care,bath&skin",
"5244","Johnsons Baby Soap 75 g","45","0","0","Johnsons Baby Soap 75 g,,baby care,bath&skin",
"5245","Johnsons Baby Soap Blossom, 100 g","55","0","0","Johnsons Baby Soap Blossom, 100 g,,baby care,bath&skin",
"5246","Johnsons Baby Soap Blossom, 200 g","99","0","0","Johnsons Baby Soap Blossom, 200 g,,baby care,bath&skin",
"5247","Johnsons Baby Soap Blossom, 75 g","45","0","0","Johnsons Baby Soap Blossom, 75 g,,baby care,bath&skin",
"5248","Johnsons Baby Soap Pack Of 12 U X 25 g","165","0","0","Johnsons Baby Soap Pack Of 12 U X 25 g,,baby care,bath&skin",
"5249","Johnsons Baby Soap Pack of 3 X 100 g each","150","0","0","Johnsons Baby Soap Pack of 3 X 100 g each,,baby care,bath&skin",
"5250","Santoor Baby Soap 75 g","30","0","0","Santoor Baby Soap 75 g,,baby care,bath&skin",
"5251","Himalaya Nourishing Baby Soap 125 gm Box","55","0","0","Himalaya Nourishing Baby Soap 125 gm Box,,baby care,bath&skin",
"5252","Chicco Massage Oil 200ml Bottle","289","0","0","Chicco Massage Oil 200ml Bottle,,baby care,bath&skin",
"5253","Himalaya Gentle Baby Soap 125 gm Box","55","0","0","Himalaya Gentle Baby Soap 125 gm Box,,baby care,bath&skin",
"5254","Chicco Gentle Body Wash & Shampoo 500ml Bottle","449","0","0","Chicco Gentle Body Wash & Shampoo 500ml Bottle,,baby care,bath&skin",
"5255","Chicco Gentle Body Wash & Shampoo 200ml Bottle","219","0","0","Chicco Gentle Body Wash & Shampoo 200ml Bottle,,baby care,bath&skin",
"5256","Johnson & Johnson Baby  Milk Soap 75 gm Carton","40","0","0","Johnson & Johnson Baby  Milk Soap 75 gm Carton,,baby care,bath&skin",
"5257","Himalaya Gentle Baby Shampoo 100ml Bottle","77","0","0","Himalaya Gentle Baby Shampoo 100ml Bottle,,baby care,bath&skin",
"5258","Himalaya Extra Moisturizing Baby Soap 125 gm Carton","55","0","0","Himalaya Extra Moisturizing Baby Soap 125 gm Carton,,baby care,bath&skin",
"5259","Himalaya Extra Moisturizing Baby Soap 75 gm Carton","35","0","0","Himalaya Extra Moisturizing Baby Soap 75 gm Carton,,baby care,bath&skin",
"5260","Chicco No Tears Bath Foam 500 ml Bottle ","549","0","0","Chicco No Tears Bath Foam 500 ml Bottle,,baby care,bath&skin",
"5261","Chicco No Tears Bath Foam 200 ml Bottle ","299","0","0","Chicco No Tears Bath Foam 200 ml Bottle ,,baby care,bath&skin",
"5262","Himalaya Gentle Baby Shampoo {Hibiscus & Chickpea} 200ml Bottle","149","0","0","Himalaya Gentle Baby Shampoo {Hibiscus & Chickpea} 200ml Bottle,,baby care,bath&skin",
"5263","Chicco Baby Powder 150 g","149","0","0","Chicco Baby Powder 150 g,,baby care,bath&skin",
"5264","Johnsons Baby Powder Pack Of 12 X 30 g","110","0","0","Johnsons Baby Powder Pack Of 12 X 30 g,,baby care,bath&skin",
"5265","Johnsons Baby Powder 400 g","165","0","0","Johnsons Baby Powder 400 g,,baby care,bath&skin",
"5266","Johnsons Baby Powder 200 g","99","0","0","Johnsons Baby Powder 200 g,,baby care,bath&skin",
"5267","Chicco Massage Oil 200ml Bottle","289","0","0","Chicco Massage Oil 200ml Bottle,,baby care,bath&skin",
"5268","Johnsons Baby Powder 700 g","270","0","0","Johnsons Baby Powder 700 g,,baby care,bath&skin",
"5269","Johnsons Baby Powder 100 g","55","0","0","Johnsons Baby Powder 100 g,,baby care,bath&skin",
"5270","Johnsons Baby Powder 50 g","30","0","0","Johnsons Baby Powder 50 g,,baby care,bath&skin",
"5271","Littles Feeding Bottle Classic Mini, 150 ml","110","0","0","Littles Feeding Bottle Classic Mini, 150 ml,,baby care,bath&skin",
"5272","Littles Puff Powder Puff","95","0","0","Littles Puff Powder Puff,,baby care,bath&skin",
"5273","Littles Bowl Mashing & Feeding Bowl","145","0","0","Littles Bowl Mashing & Feeding Bowl,,baby care,bath&skin",
"5274","Johnsons Baby Body Oil 50 ml","48","0","0","Johnsons Baby Body Oil 50 ml,,baby care,bath&skin",
"5275","Dabur Lal Baby Oil 100 ml","85","0","0","Dabur Lal Baby Oil 100 ml,,baby care,bath&skin",
"5276","Johnsons Baby Hair Oil 100 ml","63","0","0","Johnsons Baby Hair Oil 100 ml,,baby care,bath&skin",
"5277","Johnsons Baby Body Oil 100 ml","90","0","0","Johnsons Baby Body Oil 100 ml,,baby care,bath&skin",
"5278","Johnsons Baby Body Oil 200 ml","165","0","0","Johnsons Baby Body Oil 200 ml,,baby care,bath&skin",
"5279","Chicco Talcum Powder 500gm Bottle","299","0","0","Chicco Talcum Powder 500gm Bottle,,baby care,bath&skin",
"5280","Chicco Talcum Powder 150gm Bottle","149","0","0","Chicco Talcum Powder 150gm Bottle,,baby care,bath&skin",
"5281","Himalaya Baby Powder {Khus Grass}200gm Bottle","99","0","0","Himalaya Baby Powder {Khus Grass}200gm Bottle,,baby care,bath&skin",
"5282","Himalaya Baby Powder 400gm Bottle","140","0","0","Himalaya Baby Powder 400gm Bottle,,baby care,bath&skin",
"5283","Himalaya Baby Powder 100gm Bottle","55","0","0","Himalaya Baby Powder 100gm Bottle,,baby care,bath&skin",
"5284","Chicco NoTears Bath Foam 500ml Bottle","549","0","0","Chicco NoTears Bath Foam 500ml Bottle,,baby care,bath&skin",
"5285","Chicco NoTears Bath Foam 200ml Bottle","299","0","0","Chicco NoTears Bath Foam 200ml Bottle,,baby care,bath&skin",
"5286","Dabur Ayurvedic Medicine Lal Tail {massage Oil} 200ml Carton","155","0","0","Dabur Ayurvedic Medicine Lal Tail {massage Oil} 200ml Carton,,baby care,bath&skin",
"5287","Himalaya Baby Lotion Almond Oil+Olive Oil 100ml Bottle","68","0","0","Himalaya Baby Lotion Almond Oil+Olive Oil 100ml Bottle,,baby care,bath&skin",
"5288","Johnson & Johnson Baby Hair Oil 200ml Bottle","110","0","0","Johnson & Johnson Baby Hair Oil 200ml Bottle,,baby care,bath&skin",
"5289","Himalaya Baby Massage Olive OIL & Winter Cherry 200ml","165","0","0","Himalaya Baby Massage Olive OIL & Winter Cherry 200ml,,baby care,bath&skin",
"5290","Himalaya Baby Massage Olive OIL & Winter Cherry 100ml","90","0","0","Himalaya Baby Massage Olive OIL & Winter Cherry 100ml,,baby care,bath&skin",
"5291","Johnson & Johnson Baby Oil Mildness 500ml Bottle","330","0","0","Johnson & Johnson Baby Oil Mildness 500ml Bottle,,baby care,bath&skin",
"5292","Johnson & Johnson Baby Oil Mildness 100ml Bottle","90","0","0","Johnson & Johnson Baby Oil Mildness 100ml Bottle,,baby care,bath&skin",
"5293","Chicco Baby Cream Rich Cream, 100 ml","399","0","0","Chicco Baby Cream Rich Cream, 100 ml,,baby care,bath&skin",
"5294","Chicco Baby Lotion 200 ml","199","0","0","Chicco Baby Lotion 200 ml,,baby care,bath&skin",
"5295","Himalaya Baby Cream 100ml Tube ","120","0","0","Himalaya Baby Cream 100ml Tube,,baby care,bath&skin",
"5296","Chicco Baby Lotion 500 ml","399","0","0","Chicco Baby Lotion 500 ml,,baby care,bath&skin",
"5297","Himalaya Baby Lotion {Almond Oil & Olive Oil}200ml Bottle","145","0","0","Himalaya Baby Lotion {Almond Oil & Olive Oil}200ml Bottle,,baby care,bath&skin",
"5298","Chicco Cream Nappy Cream, 100 ml","249","0","0","Chicco Cream Nappy Cream, 100 ml,,baby care,bath&skin",
"5299","Johnsons Baby Cream 100 g","125","0","0","Johnsons Baby Cream 100 g,,baby care,bath&skin",
"5300","Himalaya Baby Care Gift Box ","425","0","0","Himalaya Baby Care Gift Box ,,baby care,bath&skin",
"5301","Johnsons Baby Cream 30 g","40","0","0","Johnsons Baby Cream 30 g,,baby care,bath&skin",
"5302","Himalaya Diaper Rash Cream 50gm Tube","85","0","0","Himalaya Diaper Rash Cream 50gm Tube,,baby care,bath&skin",
"5303","Johnsons Baby Cream 50 g","65","0","0","Johnsons Baby Cream 50 g,,baby care,bath&skin",
"5304","Johnsons Baby Lotion 100 ml","80","0","0","Johnsons Baby Lotion 100 ml,,baby care,bath&skin",
"5305","Johnsons Baby Lotion 200 ml","140","0","0","Johnsons Baby Lotion 200 ml,,baby care,bath&skin",
"5306","Johnsons Baby Lotion 50 ml","42","0","0","Johnsons Baby Lotion 50 ml,,baby care,bath&skin",
"5307","Johnsons Baby Milk Cream 100 g","135","0","0","Johnsons Baby Milk Cream 100 g,,baby care,bath&skin",
"5308","Himalaya Boby Lotion 400 ml Bottle ","215","0","0","Himalaya Boby Lotion 400 ml Bottle ,,baby care,bath&skin",
"5309","Johnson & Johnson Baby Care Collection Gift Set Corton","501","0","0","Johnson & Johnson Baby Care Collection Gift Set Corton,,baby care,bath&skin",
"5310","Johnsons Baby Gift Pack Luxury","501","0","0","Johnsons Baby Gift Pack Luxury,,baby care,bath&skin",
"5311","Johnsons Baby Gift Pack Large","301","0","0","Johnsons Baby Gift Pack Large,,baby care,bath&skin",
"5312","Johnsons Baby Gift Pack small","121","0","0","Johnsons Baby Gift Pack small,,baby care,bath&skin",
"5313","Johnsons Baby Gift Pack Medium","201","0","0","Johnsons Baby Gift Pack Medium,,baby care,bath&skin",
"5314","Johnsons Baby Lotion 200 ml","140","0","0","Johnsons Baby Lotion 200 ml,,baby care,bath&skin",
"5315","Johnsons Baby Lotion 50 ml","42","0","0","Johnsons Baby Lotion 50 ml,,baby care,bath&skin",
"5316","Johnsons Baby Milk Cream 100 g","135","0","0","Johnsons Baby Milk Cream 100 g,,baby care,bath&skin",
"5317","Himalaya Boby Lotion 400 ml Bottle ","215","0","0","Himalaya Boby Lotion 400 ml Bottle ,,baby care,bath&skin",
"5318","Johnson & Johnson Baby Care Collection Gift Set Corton","501","0","0","Johnson & Johnson Baby Care Collection Gift Set Corton,,baby care,bath&skin",
"5319","Johnsons Baby Gift Pack Luxury","501","0","0","Johnsons Baby Gift Pack Luxury,,baby care,bath&skin",
"5320","Johnsons Baby Gift Pack Large","301","0","0","Johnsons Baby Gift Pack Large,,baby care,bath&skin",
"5321","Johnsons Baby Gift Pack small","121","0","0","Johnsons Baby Gift Pack small,,baby care,bath&skin",
"5322","Johnsons Baby Gift Pack Medium","201","0","0","Johnsons Baby Gift Pack Medium,,baby care,bath&skin",
"5323","Britannia 100%Whole Wheat Bread 400GM Pouch","30","0","0","Britannia 100%Whole Wheat Bread 400GM Pouch,,bakery ,bread",
"5324","Daily Bread Hot Dog Bakes Fresh 150 g","25","0","0","Daily Bread Hot Dog Bakes Fresh 150 g,,bakery ,bread",
"5325","Daily Bread Sandwich Bread Bakes Fresh 400 g","30","0","0","Daily Bread Sandwich Bread Bakes Fresh 400 g,,bakery ,bread",
