"product_id","name","price","d_price","w_price","search_keyword",
"11664","Eveready AA Cell Red 1015, Pack Of 10 U","120","0","0","Eveready AA Cell Red 1015, Pack Of 10 U,home care,battries and torches",
"11665","Duracell Alkaline AAA Battery Pack of 6 U","198","0","0","Duracell Alkaline AAA Battery Pack of 6 U,home care,battries and torches",
"11666","Duracell Ultra AAA   2pcs","65","0","0","Duracell Ultra AAA   2pcs,home care,battries and torches",
"11667","Duracell 9v Battery Value Pack 2pc","440","0","0","Duracell 9v Battery Value Pack 2pc,home care,battries and torches",
"11668","Eveready Red C Size Batteries 2 Nos","35","0","0","Eveready Red C Size Batteries 2 Nos,home care,battries and torches",
"11669","Eveready Rechargeable Digi LED 180 Degree","850","0","0","Eveready Rechargeable Digi LED 180 Degree,home care,battries and torches",
"11670","Eveready Rechargeable Digi LED 360 degree","949","0","0","Eveready Rechargeable Digi LED 360 degree,home care,battries and torches",
"11671","Eveready Flashlight DL 25","135","0","0","Eveready Flashlight DL 25,home care,battries and torches",
"11672","Eveready Flashlight DL 41, Nav Josh","85","0","0","Eveready Flashlight DL 41, Nav Josh,home care,battries and torches",
"11673","Eveready Flashlight DL 71","185","0","0","Eveready Flashlight DL 71,home care,battries and torches",
"11674","Eveready Lamp Portable LED Lamp","1499","0","0","Eveready Lamp Portable LED Lamp,home care,battries and torches",
"11675","Eveready Torch Digi Led DL-02","120","0","0","Eveready Torch Digi Led DL-02,home care,battries and torches",
"11676","Eveready Torch Commander DL-66","450","0","0","Eveready Torch Commander DL-66,home care,battries and torches",
"11677","Eveready Torch Digi LED DL-50","120","0","0","Eveready Torch Digi LED DL-50,home care,battries and torches",
"11678","Eveready Torch Digi LED DL-36","100","0","0","Eveready Torch Digi LED DL-36,home care,battries and torches",
"11679","Eveready Lantern Homelite HL 04","245","0","0","Eveready Lantern Homelite HL 04,home care,battries and torches",
"11680","Eveready Torch Digi LED DL-10","140","0","0","Eveready Torch Digi LED DL-10,home care,battries and torches",
"11681","Eveready Rechargeable Torch DL-92","199","0","0","Eveready Rechargeable Torch DL-92,home care,battries and torches",
"11682","Eveready Flashlight DL 01, Venus","125","0","0","Eveready Flashlight DL 01, Venus,home care,battries and torches",
"11683","Eveready Torch Rechargeable HL 51","1575","0","0","Eveready Torch Rechargeable HL 51,home care,battries and torches",
"11684","Eveready Torch Rechargeable DL-91","300","0","0","Eveready Torch Rechargeable DL-91,home care,battries and torches",
"11685","Eveready Rechargeable Torch DL-93","249","0","0","Eveready Rechargeable Torch DL-93,home care,battries and torches",
"11686","Eveready Ultra LED Torch DL-77","245","0","0","Eveready Ultra LED Torch DL-77,home care,battries and torches",
"11687","Link-Extenction Board 4001:6 sockets","349","0","0","Link-Extenction Board 4001:6 sockets,home care,battries and torches",
"11688","Link-Extenction Board 4001:4 sockets","205","0","0","Link-Extenction Board 4001:4 sockets,home care,battries and torches",
"11689","Eveready Cfi Mini Bulb","150","0","0","Eveready Cfi Mini Bulb,home care,battries and torches",
"11690","Eveready-Digiled Dl91 Recharge","300","0","0","Eveready-Digiled Dl91 Recharge,home care,battries and torches",
"11691","Eveready Rechargeable Battery 700 NIMAH AA","250","0","0","Eveready Rechargeable Battery 700 NIMAH AA,home care,battries and torches",
"11692","Wipro-Smart Lite Cfl 2 u 15 w","200","0","0","Wipro-Smart Lite Cfl 2 u 15 w,home care,battries and torches",
"14036","Lotte Choco Pie Pack Of 6 X Rs. 10","70","0","0","Lotte Choco Pie Pack Of 6 X Rs. 10,packaged food,confectionary,",
"14037","Lotte Choco Pie Pack Of 12 X Rs. 10","140","0","0","Lotte Choco Pie Pack Of 12 X Rs. 10,packaged food,confectionary,",
"14038","Snickers Chocolate Snack Bar, Pack Of 3 X Rs. 15","54","0","0","Snickers Chocolate Snack Bar, Pack Of 3 X Rs. 15,packaged food,confectionary,",
"14039","Snickers Chocolate Miniatures, 150 g","119","0","0","Snickers Chocolate Miniatures, 150 g,packaged food,confectionary,",
"14040","Snickers Chocolate Minis Bag, 270 g","299","0","0","Snickers Chocolate Minis Bag, 270 g,packaged food,confectionary,",
"14041","Snickers Chocolate Pack Of 3 X Rs. 30","99","0","0","Snickers Chocolate Pack Of 3 X Rs. 30,packaged food,confectionary,",
"14044","Orion Chocopie Pack Of 6 U","70","0","0","Orion Chocopie Pack Of 6 U,packaged food,confectionary,",
"14045","Nestle Chocolate Milky Bar, Pack Of 28 X Rs. 5","140","0","0","Nestle Chocolate Milky Bar, Pack Of 28 X Rs. 5,packaged food,confectionary,",
"14047","Nestle Munch chocolate Pouch","90","0","0","Nestle Munch chocolate Pouch,packaged food,confectionary,",
"14048","Mars Chocolate Snack Bar, Pack Of 3 x Rs. 30","120","0","0","Mars Chocolate Snack Bar, Pack Of 3 x Rs. 30,packaged food,confectionary,",
"14049","Nestle Kit Kat Chocolate Family Pack","60","0","0","Nestle Kit Kat Chocolate Family Pack,packaged food,confectionary,",
"14050","Nestle Kit Kat Chocolate 1 Finger, Pack Of 15 X Rs. 5","100","0","0","Nestle Kit Kat Chocolate 1 Finger, Pack Of 15 X Rs. 5,packaged food,confectionary,",
"14051","Galaxy Chocolate Milk, Pack Of 3 X Rs. 30","102","0","0","Galaxy Chocolate Milk, Pack Of 3 X Rs. 30,packaged food,confectionary,",
"14053","Cadbury Gems Surprise Ball","40","0","0","Cadbury Gems Surprise Ball,packaged food,confectionary,",
"14056","Cadbury Dairy Milk Roasted Almond","45","0","0","Cadbury Dairy Milk Roasted Almond,packaged food,confectionary,",
"14057","Cadbury Dairy Milk Fruit & Nut","40","0","0","Cadbury Dairy Milk Fruit & Nut,packaged food,confectionary,",
"14058","Cadbury Dairy Milk Crackle","40","0","0","Cadbury Dairy Milk Crackle,packaged food,confectionary,",
"14059","Bounty Chocolate Miniatures, 150 g","149","0","0","Bounty Chocolate Miniatures, 150 g,packaged food,confectionary,",
"14065","Cadbury Perk Home Treat, 200 g","85","0","0","Cadbury Perk Home Treat, 200 g,packaged food,confectionary,",
"14066","Cadbury Five Star Home Treat, 200 g","150","0","0","Cadbury Five Star Home Treat, 200 g,packaged food,confectionary,",
"14067","Cadbury Dairy Milk Chocolate Home Treat, 200 g","133","0","0","Cadbury Dairy Milk Chocolate Home Treat, 200 g,packaged food,confectionary,",
"14070","Kinder Joy Chocolate Boys, Pack of 16 - 35Rs MRP each","560","0","0","Kinder Joy Chocolate Boys, Pack of 16 - 35Rs MRP each,packaged food,confectionary,",
"14071","Kinder Joy Chocolate Boys, Pack of 8 - 35Rs MRP each","280","0","0","Kinder Joy Chocolate Boys, Pack of 8 - 35Rs MRP each,packaged food,confectionary,",
"14073","Orion Chocopie Pack Of 12 X Rs. 10","140","0","0","Orion Chocopie Pack Of 12 X Rs. 10,packaged food,confectionary,",
"14075","Bar One Chocolate 12gm Pouch","5","0","0","Bar One Chocolate 12gm Pouch,packaged food,confectionary,",
"14076","5 Star Fruit & nut chocolate 36gm Pack","30","0","0","5 Star Fruit & nut chocolate 36gm Pack,packaged food,confectionary,",
"14077","Alpenliebe Rich Milky Caramel Toffee 500","100","0","0","Alpenliebe Rich Milky Caramel Toffee 500,packaged food,confectionary,",
"14078","Alpenliebe Caram Strawberry 500gm Pouch","100","0","0","Alpenliebe Caram Strawberry 500gm Pouch,packaged food,confectionary,",
"14079","Alpenliebe Caramfills Butter Toffee200gm Pouch","50","0","0","Alpenliebe Caramfills Butter Toffee200gm Pouch,packaged food,confectionary,",
"14080","Alpenliebe Mangofillz 250gm Pouch","50","0","0","Alpenliebe Mangofillz 250gm Pouch,packaged food,confectionary,",
"14081","Alpenliebe 2 Choco Eclairs 210gm Pouch","50","0","0","Alpenliebe 2 Choco Eclairs 210gm Pouch,packaged food,confectionary,",
"14082","Ask White Chocolate Cking 150gm Pouch","85","0","0","Ask White Chocolate Cking 150gm Pouch,packaged food,confectionary,",
"14083","Ask Dark Chocolate Cking 150gm Pouch","80","0","0","Ask Dark Chocolate Cking 150gm Pouch,packaged food,confectionary,",
"14084","Bounty Miniaturesn150gm Pouch","149","0","0","Bounty Miniaturesn150gm Pouch,packaged food,confectionary,",
"14085","Cadbury Dairy Milk Shots 14.4gm Pouch","10","0","0","Cadbury Dairy Milk Shots 14.4gm Pouch,packaged food,confectionary,",
"14086","Cadbury Bournville Rich Cocoa 80 gm Pouch","100","0","0","Cadbury Bournville Rich Cocoa 80 gm Pouch,packaged food,confectionary,",
"14087","Cadbury Dairy Milk Silk Chocolate  160 gm","150","0","0","Cadbury Dairy Milk Silk Chocolate  160 gm,packaged food,confectionary,",
"14088","Cadbury Temptations Almond Treat 72gm pouch","80","0","0","Cadbury Temptations Almond Treat 72gm pouch,packaged food,confectionary,",
"14089","Cadbury Temptatios Rum Raisins 72gm pouch","80","0","0","Cadbury Temptatios Rum Raisins 72gm pouch,packaged food,confectionary,",
"14090","Cadbury Bournville Rich Cranberry 80 gm Pouch","100","0","0","Cadbury Bournville Rich Cranberry 80 gm Pouch,packaged food,confectionary,",
"14091","Cadbury Bournville Raisin and Nut 80 gm Pouch","95","0","0","Cadbury Bournville Raisin and Nut 80 gm Pouch,packaged food,confectionary,",
"14092","Cadbury 5 Star Chomp 50 gm Pouch ","25","0","0","Cadbury 5 Star Chomp 50 gm Pouch ,packaged food,confectionary,",
"14093","Cadbury Cocoa 200gm Cup","180","0","0","Cadbury Cocoa 200gm Cup,packaged food,confectionary,",
"14094","Cadbury Gems Surprise Play Pack 40.94gm..","90","0","0","Cadbury Gems Surprise Play Pack 40.94gm..,packaged food,confectionary,",
"14095","Caadbury Choclairs 517.5gm Pouch","115","0","0","Caadbury Choclairs 517.5gm Pouch,packaged food,confectionary,",
"14096","Caadbury Tempatations Cashew Appeal 72gm","80","0","0","Caadbury Tempatations Cashew Appeal 72gm,packaged food,confectionary,",
"14097","Candyman Fruitee Fun 330 gm Pouch","50","0","0","Candyman Fruitee Fun 330 gm Pouch,packaged food,confectionary,",
"14098","Cadbury Bournville Cranberry 80gms Pouch","100","0","0","Cadbury Bournville Cranberry 80gms Pouch,packaged food,confectionary,",
"14099","Choco Swiss Almond 250gm Carton","110","0","0","Choco Swiss Almond 250gm Carton,packaged food,confectionary,",
"14100","Parle Kismi Toffee 294gm Pouch","50","0","0","Parle Kismi Toffee 294gm Pouch,packaged food,confectionary,",
"14101","Nestle Munch 151.5gm Pouch","90","0","0","Nestle Munch 151.5gm Pouch,packaged food,confectionary,",
"14102","Toblerone Chocolate Honey and Almond 50....","65","0","0","Toblerone Chocolate Honey and Almond 50....,packaged food,confectionary,",
"14103","Parle Melody Chocolaty 391gm Pouch","100","0","0","Parle Melody Chocolaty 391gm Pouch,packaged food,confectionary,",
"14104","Twix Chocolate 50gm Pouch","45","0","0","Twix Chocolate 50gm Pouch,packaged food,confectionary,",
"14105","Schogetten Alpine Milk Chocolate 100gm","125","0","0","Schogetten Alpine Milk Chocolate 100gm,packaged food,confectionary,",
"14106","Ferreo Kinder Joy 20gm Ball","35","0","0","Ferreo Kinder Joy 20gm Ball,packaged food,confectionary,",
"14107","Schogetten Alpine Milk Chocolate with ha...","125","0","0","Schogetten Alpine Milk Chocolate with ha...,packaged food,confectionary,",
"14108","Mars Minis 227gm Pouch","229","0","0","Mars Minis 227gm Pouch,packaged food,confectionary,",
"14109","Dabur Hajmola Candy Aam+Imli, 250 U Jar","125","0","0","Dabur Hajmola Candy Aam+Imli, 250 U Jar,packaged food,confectionary,",
"14113","Dabur Hajmola Digestive Tablets Regular","20","0","0","Dabur Hajmola Digestive Tablets Regular,packaged food,confectionary,",
"14114","McVities Digestives Milk Chocolate Cookies","168","0","0","McVities Digestives Milk Chocolate Cookies,packaged food,confectionary,",
"14115","Dilbahars Digestives Adrak Pachak 100gm.","90","0","0","Dilbahars Digestives Adrak Pachak 100gm.,packaged food,confectionary,",
"14116","Dilbahars Digestives Khatta Chhuhara 160gm.","81","0","0","Dilbahars Digestives Khatta Chhuhara 160gm.,packaged food,confectionary,",
"14117","Unibic Oatmeal Digestive Cookies 200gm","40","0","0","Unibic Oatmeal Digestive Cookies 200gm,packaged food,confectionary,",
"14118","Parle Digestive Apple&cinnamon Biscuits....","50","0","0","Parle Digestive Apple&cinnamon Biscuits....,packaged food,confectionary,",
"14119","Parle Digestive Honey&Oats Biscuits....","50","0","0","Parle Digestive Honey&Oats Biscuits....,packaged food,confectionary,",
"14120","McVities Digestive Biscuits Bipashas sig...","100","0","0","McVities Digestive Biscuits Bipashas sig...,packaged food,confectionary,",
"14121","Britannia Nutri Choice Oats Cookies 150","55","0","0","Britannia Nutri Choice Oats Cookies 150,packaged food,confectionary,",
"14122","Britannia Nutri Choice 5 Grain 200gm Ca..","50","0","0","Britannia Nutri Choice 5 Grain 200gm Ca..,packaged food,confectionary,",
"14123","Britannia Nutri Choice Ragi Cookies 150gm Ca..","55","0","0","Britannia Nutri Choice Ragi Cookies 150gm Ca..,packaged food,confectionary,",
"14124","Unibc Anzac Oatmeal Cookies 150gm Cart","40","0","0","Unibc Anzac Oatmeal Cookies 150gm Cart,packaged food,confectionary,",
"14125","Unibic Sugarfree Butter Cookies 75gm ca.....","35","0","0","Unibic Sugarfree Butter Cookies 75gm ca.....,packaged food,confectionary,",
"14126","Sunfeast Farmlite Oats and Almonds 150g..","50","0","0","Sunfeast Farmlite Oats and Almonds 150g..,packaged food,confectionary,",
"14127","Britannia Nutri Choice essdentials Oat co....","55","0","0","Britannia Nutri Choice essdentials Oat co....,packaged food,confectionary,",
"14128","Sugarless Bliss  Chocolate and Black Curr...","155","0","0","Sugarless Bliss  Chocolate and Black Curr...,packaged food,confectionary,",
"14129","McVities HobNos Oat Biscuits 300gm Car...","141","0","0","McVities HobNos Oat Biscuits 300gm Car...,packaged food,confectionary,",
"14130","Sugarless Bliss Vanilla Butter Cookies 2...","155","0","0","Sugarless Bliss Vanilla Butter Cookies 2...,packaged food,confectionary,",
"14131","Sugarless Bliss  Natural Fig Biscotti Coo...","155","0","0","Sugarless Bliss  Natural Fig Biscotti Coo...,packaged food,confectionary,",
"14132","Britannia NutriChoice Essentials Ragi Co..","55","0","0","Britannia NutriChoice Essentials Ragi Co..,packaged food,confectionary,",
"14133","McVities Ginger nuts Biscuits  100gm Pack","25","0","0","McVities Ginger nuts Biscuits  100gm Pack,packaged food,confectionary,",
"14134","Britannia Nutri Choice  essentials Oat Co.....","30","0","0","Britannia Nutri Choice  essentials Oat Co.....,packaged food,confectionary,",
"14135","McVities Hobnobs Oat Cookies 150gm Car...","40","0","0","McVities Hobnobs Oat Cookies 150gm Car...,packaged food,confectionary,",
"14136","Sunfeast Farmlite Oats and Raising 150g..","50","0","0","Sunfeast Farmlite Oats and Raising 150g..,packaged food,confectionary,",
"14137","Unibc Sugarfree Oatmeal Cookies 75gm Cart","35","0","0","Unibc Sugarfree Oatmeal Cookies 75gm Cart,packaged food,confectionary,",
"14138","Parle Actifit Cream Cracker Sugarless 10...","15","0","0","Parle Actifit Cream Cracker Sugarless 10...,packaged food,confectionary,",
"14139","Dibahars Digestives Shodhy Harad215gm","75","0","0","Dibahars Digestives Shodhy Harad215gm,packaged food,confectionary,",
"14140","Parle Digestive Marien250gm Pouch","30","0","0","Parle Digestive Marien250gm Pouch,packaged food,confectionary,",
"14141","Dilbahars Digestives Ajwain Pachak 190gm.","99","0","0","Dilbahars Digestives Ajwain Pachak 190gm.,packaged food,confectionary,",
"14144","Tic Tac Breath Mint Strawberry, Pack Of 6 X Rs. 15","90","0","0","Tic Tac Breath Mint Strawberry, Pack Of 6 X Rs. 15,packaged food,confectionary,",
"14145","Tic Tac Breath Mint Intensity, Pack Of 6 X Rs. 15","90","0","0","Tic Tac Breath Mint Intensity, Pack Of 6 X Rs. 15,packaged food,confectionary,",
"14146","Tic Tac Breath Mint Peach Passion, Pack Of 6 X Rs. 10","60","0","0","Tic Tac Breath Mint Peach Passion, Pack Of 6 X Rs. 10,packaged food,confectionary,",
"14149","Polo Mint Pack Of 50 X Rs. 2","130","0","0","Polo Mint Pack Of 50 X Rs. 2,packaged food,confectionary,",
"14150","Polo Mint Box Pack Of 20 X Rs. 5","110","0","0","Polo Mint Box Pack Of 20 X Rs. 5,packaged food,confectionary,",
"14152","Wrigley Chewing Gum WinterFrost, Pack Of 24 X Rs. 5","150","0","0","Wrigley Chewing Gum WinterFrost, Pack Of 24 X Rs. 5,packaged food,confectionary,",
"14153","Orbit Chewing Gum Lime, Pack Of 24 X Rs. 5","120","0","0","Orbit Chewing Gum Lime, Pack Of 24 X Rs. 5,packaged food,confectionary,",
"14154","Orbit Chewing Gum Spearmint, Pack Of 24 x Rs. 5","120","0","0","Orbit Chewing Gum Spearmint, Pack Of 24 x Rs. 5,packaged food,confectionary,",
"14155","Orbit Chewing Gum Fruit , Pack Of 24 X Rs. 5","120","0","0","Orbit Chewing Gum Fruit , Pack Of 24 X Rs. 5,packaged food,confectionary,",
"14156","Center Fresh Chewing Gum Stick, Pack Of 24","150","0","0","Center Fresh Chewing Gum Stick, Pack Of 24,packaged food,confectionary,",
"14162","Center Fresh Chewing Gum Spearmint, Pack Of 176 U","176","0","0","Center Fresh Chewing Gum Spearmint, Pack Of 176 U,packaged food,confectionary,",
"14166","Tic Tac Breath Mint Elaichi, Pack Of 6 X Rs. 10","60","0","0","Tic Tac Breath Mint Elaichi, Pack Of 6 X Rs. 10,packaged food,confectionary,",
"14167","Tic Tac Breath Mint Assorted, Pack Of 12 X Rs. 10","120","0","0","Tic Tac Breath Mint Assorted, Pack Of 12 X Rs. 10,packaged food,confectionary,",
"14168","Orbit Chewing Gum White, Pack Of 24 X Rs. 5","120","0","0","Orbit Chewing Gum White, Pack Of 24 X Rs. 5,packaged food,confectionary,",
"14170","Orbit sugar free Chewing Gum mixed Fruit of 5 NOs","5","0","0","Orbit sugar free Chewing Gum mixed Fruit of 5 NOs,packaged food,confectionary,",
"14171","Chingles Tutti Fruit chewing Gums 21.6 gms carton","10","0","0","Chingles Tutti Fruit chewing Gums 21.6 gms carton,packaged food,confectionary,",
"14172","Chingles nimbu flavour chewing gums 21.6 gms carton","10","0","0","Chingles nimbu flavour chewing gums 21.6 gms carton,packaged food,confectionary,",
"14173","Happydent Complete Sugar Free 27.5 gms Bottle","30","0","0","Happydent Complete Sugar Free 27.5 gms Bottle,packaged food,confectionary,",
"14174","Orbit sugar free Chewing Gum winterfrost of 5 Nos","5","0","0","Orbit sugar free Chewing Gum winterfrost of 5 Nos,packaged food,confectionary,",
"14175","Orbit sugar free chewing gum Spearmint 25 Nos Box","50","0","0","Orbit sugar free chewing gum Spearmint 25 Nos Box,packaged food,confectionary,",
"14176","Orbit Sugarfree Chewing Gum Lime 5 Nos Carton","5","0","0","Orbit Sugarfree Chewing Gum Lime 5 Nos Carton,packaged food,confectionary,",
"14177","Orbit sugar free chewing gum spearmint 5 Nos","5","0","0","Orbit sugar free chewing gum spearmint 5 Nos,packaged food,confectionary,",
"14178","Chingles Saunf Flavour 21.6 gms pack","10","0","0","Chingles Saunf Flavour 21.6 gms pack,packaged food,confectionary,",
"14179","Happydent Complete peppermint 6NOs ","5","0","0","Happydent Complete peppermint 6NOs ,packaged food,confectionary,",
"14180","Center Fruit 30.4 gm pack","10","0","0","Center Fruit 30.4 gm pack,packaged food,confectionary,",
"14181","Happydent Complete peppermint Flavour 27.5 gm Box","30","0","0","Happydent Complete peppermint Flavour 27.5 gm Box,packaged food,confectionary,",
"14182","Orbit sugar free chewing gum spearmint 9 nos ","10","0","0","Orbit sugar free chewing gum spearmint 9 nos ,packaged food,confectionary,",
"14183","Chingles Mint Flavour 21.6gms box","10","0","0","Chingles Mint Flavour 21.6gms box,packaged food,confectionary,",
"14184","Happydent Wave peppermint Flavour Flip 19gm box","10","0","0","Happydent Wave peppermint Flavour Flip 19gm box,packaged food,confectionary,",
"14185","Smint sugar free mint chewing gum","40","0","0","Smint sugar free mint chewing gum,packaged food,confectionary,",
"14198","Britannia Biscuit Tiger, 133 g","10","0","0","Britannia Biscuit Tiger, 133 g,packaged food,confectionary,",
"14199","Sunfeast Glucose Biscuits Pack Of 24 X 40 g","72","0","0","Sunfeast Glucose Biscuits Pack Of 24 X 40 g,packaged food,confectionary,",
"14200","Sunfeast Glucose Biscuits Pack Of 30 X 24 g","60","0","0","Sunfeast Glucose Biscuits Pack Of 30 X 24 g,packaged food,confectionary,",
"14201","Parle-G Biscuits 800 g","55","0","0","Parle-G Biscuits 800 g,packaged food,confectionary,",
"14202","Parle-G Biscuits Pack Of 24 X 72 g","120","0","0","Parle-G Biscuits Pack Of 24 X 72 g,packaged food,confectionary,",
"14203","Parle-G Biscuits 300 g","20","0","0","Parle-G Biscuits 300 g,packaged food,confectionary,",
"14204","Parle-G Biscuits Pack Of 30 X 28 g","60","0","0","Parle-G Biscuits Pack Of 30 X 28 g,packaged food,confectionary,",
"14205","Parle-G Biscuits 144 g","10","0","0","Parle-G Biscuits 144 g,packaged food,confectionary,",
"14207","Glucon D Glucose Tangy Original Flavour 450 gm Carton","126","0","0","Glucon D Glucose Tangy Original Flavour 450 gm Carton,packaged food,confectionary,",
"14208","Glucon D Glucose Tangy Original Flavour 200 gm Carton","58","0","0","Glucon D Glucose Tangy Original Flavour 200 gm Carton,packaged food,confectionary,",
"14209","Sanfeast Glucose Biscuits 250 gm Pouch","20","0","0","Sanfeast Glucose Biscuits 250 gm Pouch,packaged food,confectionary,",
"14210","Dabur Glucose D Cooling Energy 1 Kg Jar","157","0","0","Dabur Glucose D Cooling Energy 1 Kg Jar,packaged food,confectionary,",
"14211","Glucon D Pure Glucose Original 500 gm Jar","92","0","0","Glucon D Pure Glucose Original 500 gm Jar,packaged food,confectionary,",
"14212","Glucon D Pure Glucose Original 200 gm Carton","43","0","0","Glucon D Pure Glucose Original 200 gm Carton,packaged food,confectionary,",
"14213","Cadbury Perk With Glucose Energy 17 gm Pouch","5","0","0","Cadbury Perk With Glucose Energy 17 gm Pouch,packaged food,confectionary,",
"14214","Glucon D Pure Glucose Original 500 gm Jar","95","0","0","Glucon D Pure Glucose Original 500 gm Jar,packaged food,confectionary,",
"14215","Glucon D Pure Glucose Original 200 gm Carton","43","0","0","Glucon D Pure Glucose Original 200 gm Carton,packaged food,confectionary,",
"14216","Britaannia Tiger Glucose Biscuits 125 gm Pouch","10","0","0","Britaannia Tiger Glucose Biscuits 125 gm Pouch,packaged food,confectionary,",
"14217","Glucon D Pure Glucose Nimbu Pani Flavour 500 gm Carton","126","0","0","Glucon D Pure Glucose Nimbu Pani Flavour 500 gm Carton,packaged food,confectionary,",
"14218","Glucon D Pure Glucose Nimbu Pani Flavour 200 gm Carton","58","0","0","Glucon D Pure Glucose Nimbu Pani Flavour 200 gm Carton,packaged food,confectionary,",
"14219","Parle G Original Gluco Biscuit 70 gm Pack","5","0","0","Parle G Original Gluco Biscuit 70 gm Pack,packaged food,confectionary,",
"14220","Britannia Milk Bikis Biscuit 85 gm Pouch","10","0","0","Britannia Milk Bikis Biscuit 85 gm Pouch,packaged food,confectionary,",
"14221","Parle G Biscuits 250 gm Pouch ","20","0","0","Parle G Biscuits 250 gm Pouch ,packaged food,confectionary,",
"14222","Parle Parle G Gold 200 gm Pouch","20","0","0","Parle Parle G Gold 200 gm Pouch,packaged food,confectionary,",
"14223","Britannia Milk Bikis Cream Biscuits 100 gm Pouch","20","0","0","Britannia Milk Bikis Cream Biscuits 100 gm Pouch,packaged food,confectionary,",
"14224","Britannia Milk Bikis Biscuits 85 gm Pouch","10","0","0","Britannia Milk Bikis Biscuits 85 gm Pouch,packaged food,confectionary,",
"14225","Britannia Nutrichoice Biscuits Oatmeal, 75 g","30","0","0","Britannia Nutrichoice Biscuits Oatmeal, 75 g,packaged food,confectionary,",
"14226","Britannia Nutrichoice Biscuits Digestive, 75 g","15","0","0","Britannia Nutrichoice Biscuits Digestive, 75 g,packaged food,confectionary,",
"14227","Sunfeast Marie Oats 100 g","15","0","0","Sunfeast Marie Oats 100 g,packaged food,confectionary,",
"14228","Sunfeast Marie Lite 250 g","20","0","0","Sunfeast Marie Lite 250 g,packaged food,confectionary,",
"14229","Britannia Vita Marie 150 g","20","0","0","Britannia Vita Marie 150 g,packaged food,confectionary,",
"14230","Britannia Milk Bikis 200 g","22","0","0","Britannia Milk Bikis 200 g,packaged food,confectionary,",
"14231","Britannia Milk Bikis Air Tight Container, 150 g","20","0","0","Britannia Milk Bikis Air Tight Container, 150 g,packaged food,confectionary,",
"14232","Britannia Milk Bikis 100 g","10","0","0","Britannia Milk Bikis 100 g,packaged food,confectionary,",
"14234","Britannia Mariegold 300 g","27","0","0","Britannia Mariegold 300 g,packaged food,confectionary,",
"14235","Britannia Mariegold 200 g","22","0","0","Britannia Mariegold 200 g,packaged food,confectionary,",
"14236","Britannia Mariegold 150 g","15","0","0","Britannia Mariegold 150 g,packaged food,confectionary,",
"14237","Britannia Mariegold 100 g","10","0","0","Britannia Mariegold 100 g,packaged food,confectionary,",
"14238","Britannia Biscuits Brita, 150 g","20","0","0","Britannia Biscuits Brita, 150 g,packaged food,confectionary,",
"14239","Britannia Nutrichoice Biscuits Ragi, 75 g","30","0","0","Britannia Nutrichoice Biscuits Ragi, 75 g,packaged food,confectionary,",
"14240","Britannia Nutrichoice Biscuits Ragi, 150 g","55","0","0","Britannia Nutrichoice Biscuits Ragi, 150 g,packaged food,confectionary,",
"14241","Britannia Nutrichoice Biscuits Oatmeal, 150 g","55","0","0","Britannia Nutrichoice Biscuits Oatmeal, 150 g,packaged food,confectionary,",
"14242","Britannia Nutrichoice Biscuits Digestive, 250 g","50","0","0","Britannia Nutrichoice Biscuits Digestive, 250 g,packaged food,confectionary,",
"14243","Britannia Nutrichoice Biscuits Classic Lite, 100 g","15","0","0","Britannia Nutrichoice Biscuits Classic Lite, 100 g,packaged food,confectionary,",
"14244","Britannia Nutrichoice Biscuits Arrowroot, 150 g","20","0","0","Britannia Nutrichoice Biscuits Arrowroot, 150 g,packaged food,confectionary,",
"14245","Britannia Biscuits Heavens Oats Almond Banana","40","0","0","Britannia Biscuits Heavens Oats Almond Banana,packaged food,confectionary,",
