"product_id","name","price","d_price","w_price","search_keyword",
"6410","Radikal Apica Mist Premium Basmati Rice 5 kg Pouch","170","157","0","Radikal Apica Mist Premium Basmati Rice 5 kg Pouch,grocery&staples,rice ",
"6411","Raina Drops Rozana Basmati Rice 5kg","650","643","0","Raina Drops Rozana Basmati Rice 5kg,grocery&staples,rice ",
"6412","India Gate Classic Basmati Rice 5 kg Pouch","1040","906","0","India Gate Classic Basmati Rice 5 kg Pouch,grocery&staples,rice ",
"6413","India Gate Classic Basmati Rice 1 kg Pouch","209","186","0","India Gate Classic Basmati Rice 1 kg Pouch,grocery&staples,rice ",
"6414","Daawat Brown Basmati Rice 5kg  pouch","750","739","0","Daawat Brown Basmati Rice 5kg  pouch,grocery&staples,rice ",
"6415","India Gate Super Basmati Rice 5 kg pouch","840","662","0","India Gate Super Basmati Rice 5 kg pouch,grocery&staples,rice ",
"6416","India Gate Super Basmati Rice 1 kg pouch","169","136","0","India Gate Super Basmati Rice 1 kg pouch,grocery&staples,rice ",
"6417","Daawat Super Basmati Rice 5 kg","810","807","0","Daawat Super Basmati Rice 5 kg,grocery&staples,rice ",
"6418","Daawat Super Basmati Rice 1 kg","184","181","0","Daawat Super Basmati Rice 1 kg,grocery&staples,rice ",
"6419","Kohinoor Platinum basmati Rice 5kg Bag","1290","946","0","Kohinoor Platinum basmati Rice 5kg Bag,grocery&staples,rice ",
"6420","Kohinoor Platinum basmati Rice 1kg Bag","269","266","0","Kohinoor Platinum basmati Rice 1kg Bag,grocery&staples,rice ",
"6421","Daawat Pulav Basmati Rice 5 kg Bag","820","739.5","0","Daawat Pulav Basmati Rice 5 kg Bag,grocery&staples,rice ",
"6422","Daawat Pulav Basmati Rice 1 kg Bag","195","179","0","Daawat Pulav Basmati Rice 1 kg Bag,grocery&staples,rice ",
"6423","Kohinoor Everday Basmati Rice 5kg Bag","501","474","0","Kohinoor Everday Basmati Rice 5kg Bag,grocery&staples,rice ",
"6424","Kohinoor Everday Basmati Rice 1kg Bag","104","102","0","Kohinoor Everday Basmati Rice 1kg Bag,grocery&staples,rice ",
"6425","Daawat Devaaya Basmati Rice 5kg Bag","510","0","0","Daawat Devaaya Basmati Rice 5kg Bag,grocery&staples,rice ",
"6426","Daawat Devaaya Basmati Rice 1kg Bag","105","0","0","Daawat Devaaya Basmati Rice 1kg Bag,grocery&staples,rice ",
"6427","Daawat Biryani Basmati Rice 5KG Bag","970","738.5","0","Daawat Biryani Basmati Rice 5KG Bag,grocery&staples,rice ",
"6428","Daawat Biryani Basmati Rice 1KG Bag","189","179","0","Daawat Biryani Basmati Rice 1KG Bag,grocery&staples,rice ",
"6429","india gate dubar Basmati Rice 5kg Bag","645","457","0","india gate dubar Basmati Rice 5kg Bag,grocery&staples,rice ",
"6430","india gate dabur Basmati Rice 1kg Bag","130","94","0","india gate dabur Basmati Rice 1kg Bag,grocery&staples,rice ",
"6431","Daawat Brown Rice 1kg Jar","170","161","0","Daawat Brown Rice 1kg Jar,grocery&staples,rice ",
"6432","India Gate Brown Rice 1kg Jar","120","112","0","India Gate Brown Rice 1kg Jar,grocery&staples,rice ",
"6433","Daawat Rozana Basmati Rice Gold 5kg Bag","553","528","0","Daawat Rozana Basmati Rice Gold 5kg Bag,grocery&staples,rice ",
"6434","Daawat Traditional Basmati Rice 5kg Bag","970","928","0","Daawat Traditional Basmati Rice 5kg Bag,grocery&staples,rice ",
"6435","Daawat Traditional Basmati Rice 1kg Bag","195","186","0","Daawat Traditional Basmati Rice 1kg Bag,grocery&staples,rice ",
"6436","India Gate Tiber Basmati Rice 5kg Bag","720","697","0","India Gate Tiber Basmati Rice 5kg Bag,grocery&staples,rice ",
"6437","India Gate Tiber Basmati Rice 1kg Bag","145","136","0","India Gate Tiber Basmati Rice 1kg Bag,grocery&staples,rice ",
"6438","Kohinoor Silver Basmati Rice 5kg Bag","765","754","0","Kohinoor Silver Basmati Rice 5kg Bag,grocery&staples,rice ",
"6439","India Gate Bemisal Basmati Rice 5kg Bag","795","782","0","India Gate Bemisal Basmati Rice 5kg Bag,grocery&staples,rice ",
"6440","Terra Green Organic Sonamasuri Polished Rice 1kg Bag","85","0","0","Terra Green Organic Sonamasuri Polished Rice 1kg Bag,grocery&staples,rice ",
"6441","Lal Qilla Basmati Rice 1kg Bag","235","0","0","Lal Qilla Basmati Rice 1kg Bag,grocery&staples,rice ",
"6442","Best Shashi Pakwan Rice 1kg Bag","120","198","0","Best Shashi Pakwan Rice 1kg Bag,grocery&staples,rice ",
"6443","Millet Bowl Ragi Flour Pouch 1kg","85","70","0","Millet Bowl Ragi Flour Pouch 1kg,grocery&staples,ragi",
"6444","Millet Bowl Multigrain Flour Pouch 1kg","85","0","0","Millet Bowl Multigrain Flour Pouch 1kg,grocery&staples,flour",
"6445","Nutrela Ready Mix Kheer, 180 g","50","34","0","Nutrela Ready Mix Kheer, 180 g,grocery&staples,flour",
"6446","Nutrela Ready Mix Khaman, 180 g","40","34","0","Nutrela Ready Mix Khaman, 180 g,grocery&staples,flour",
"6447","Ratna Gold Bombay Rawa 1 Kg","49","44","34","Ratna Gold Bombay Rawa 1 Kg,grocery&staples,flour",
"6448","Rishta Chakki Atta 50 Kg","1400","1254.42","0","Rishta Chakki Atta 50 Kg,grocery&staples,flour",
"6449","Rishta Chakki Atta 25 Kg","750","647.25","525","Rishta Chakki Atta 25 Kg,grocery&staples,flour",
"6450","Rishta Chakki Atta 10 Kg","400","300.43","239","Rishta Chakki Atta 10 Kg,grocery&staples,flour",
"6451","Rishta Chakki Atta 5 Kg","200","150.9","124","Rishta Chakki Atta 5 Kg,grocery&staples,flour",
"6452","Rishta Chakki Atta 1 Kg","40","35","26","Rishta Chakki Atta 1 Kg,grocery&staples,flour",
"6455","Aashirwad Select Atta 5 Kg","245","233","0","Aashirwad Select Atta 5 Kg,grocery&staples,flour",
"6456","Pillsbury Multigrain Atta 1 Kg","52","48","0","Pillsbury Multigrain Atta 1 Kg,grocery&staples,flour",
"6457","Pillsbury Chakki Atta 10 Kg","390","338.99","0","Pillsbury Chakki Atta 10 Kg,grocery&staples,flour",
"6458","Pillsbury Chakki Atta 1 Kg","45","42.9","0","Pillsbury Chakki Atta 1 Kg,grocery&staples,flour",
"6459","MTR Dosa Mix 500 g","73","67.36","66","MTR Dosa Mix 500 g,grocery&staples,flour",
"6460","MTR Gulab Jamun 500 g","135","127.63","123","MTR Gulab Jamun 500 g,grocery&staples,flour",
"6461","MTR Gulab Jamun 200 g","80","74.73","73","MTR Gulab Jamun 200 g,grocery&staples,flour",
"6462","MTR Rava Idli Mix 1 Kg","135","127.27","123","MTR Rava Idli Mix 1 Kg,grocery&staples,flour",
"6463","MTR Rava Idli Mix 500 gm","75","72.75","68","MTR Rava Idli Mix 500 gm,grocery&staples,flour",
"6464","Ratna Gold Maida 5 Kg","228","203.22","169","Ratna Gold Maida 5 Kg,grocery&staples,flour",
"6465","Ratna Gold Maida 1 Kg","47","42.19","35","Ratna Gold Maida 1 Kg,grocery&staples,flour",
"6466","Ratna Gold Idli Rawa 1 Kg","41","36.75","31","Ratna Gold Idli Rawa 1 Kg,grocery&staples,flour",
"6467","Shalimar Maida 50 Kg","1500","1389","1111","Shalimar Maida 50 Kg,grocery&staples,flour",
"6468","VSR Besan Pouch 1kg","90","0","0","VSR Besan Pouch 1kg,grocery&staples,flour",
"6469","VSR Besan Pouch 500 gm","46","0","0","VSR Besan Pouch 500 gm,grocery&staples,flour",
"6470","Rice Flour 500gm","22","18","0","Rice Flour 500gm,grocery&staples,flour",
"6471","Bajra Flour 500 gm","40","0","0","Bajra Flour 500 gm,grocery&staples,flour",
"6472","Shalimar Chakki Atta 50 Kg","1400","1295.16","1205","Shalimar Chakki Atta 50 Kg,grocery&staples,flour",
"6473","Ratna Gold Bansi Rawa 500 g","31","27.69","23","Ratna Gold Bansi Rawa 500 g,grocery&staples,flour",
"6474","Ragi Flour 1kg","57","48","0","Ragi Flour 1kg,grocery&staples,flour",
"6475","Ragi Flour 500 gm","28","26","0","Ragi Flour 500 gm,grocery&staples,flour",
"6476","Ratna Gold Wheat Rawa 500 g","70","62.5","53","Ratna Gold Wheat Rawa 500 g,grocery&staples,flour",
"6477","VSR Ragi Flour Pouch 1kg","54","0","0","VSR Ragi Flour Pouch 1kg,grocery&staples,flour",
"6478","VSR Ragi Flour Pouch 500 gm","28","0","0","VSR Ragi Flour Pouch 500 gm,grocery&staples,flour",
"6479","Ratna Gold Rice Flour 500 g","22","19.96","16","Ratna Gold Rice Flour 500 g,grocery&staples,flour",
"6480","Ratna Gold Ragi Flour 500 g","32","28","23","Ratna Gold Ragi Flour 500 g,grocery&staples,flour",
"6481","Pillsbry Chakki Fresh Atta 10kg","390","355","322","Pillsbry Chakki Fresh Atta 10kg,grocery&staples,flour",
"6482","Pillsbry Chakki Fresh Atta 5 kg","215","178","0","Pillsbry Chakki Fresh Atta 5 kg,grocery&staples,flour",
"6483","Pillsbry Chakki Fresh Atta 2 kg","90","0","0","Pillsbry Chakki Fresh Atta 2 kg,grocery&staples,flour",
"6484","Pillsbry Chakki Fresh Atta 1 kg","45","43","39","Pillsbry Chakki Fresh Atta 1 kg,grocery&staples,flour",
"6485","Aashirvad Multigrain Atta 1 Kg","52","49.99","46","Aashirvad Multigrain Atta 1 Kg,grocery&staples,flour",
"6486","Aashirvaad Chakki Atta 5 Kg","220","188.6","181","Aashirvaad Chakki Atta 5 Kg,grocery&staples,flour",
"6487","Aashirvaad Chakki Atta 1 Kg","46","40.63","38","Aashirvaad Chakki Atta 1 Kg,grocery&staples,flour",
"6488","Aashirwaad Gulab Jamun Mix 200 g","72","66.42","65","Aashirwaad Gulab Jamun Mix 200 g,grocery&staples,flour",
"6489","VSR Rice Rawa Pouch 1kg","46","0","0","VSR Rice Rawa Pouch 1kg,grocery&staples,flour",
"6490","VSR Brown Rawa Pouch 500gm","65","0","0","VSR Brown Rawa Pouch 500gm,grocery&staples,flour",
"6491","Lapsi Rawa Small 500gm","29","0","0","Lapsi Rawa Small 500gm,grocery&staples,flour",
"6492","Double Parrot Besan 1 Kg","100","69.6","74","Double Parrot Besan 1 Kg,grocery&staples,flour",
"6493","Minar Mill Fresh Atta 50 Kg","1400","1266.52","1137","Minar Mill Fresh Atta 50 Kg,grocery&staples,flour",
"6494","Minar Premium Chakki Atta 25 Kg","800","598.65","549","Minar Premium Chakki Atta 25 Kg,grocery&staples,flour",
"6495","Minar Premium Chakki Atta 50  Kg","1500","1199.01","1090","Minar Premium Chakki Atta 50  Kg,grocery&staples,flour",
"6496","Minar Premium Rawa 50 Kg","1600","1535.2","1396","Minar Premium Rawa 50 Kg,grocery&staples,flour",
"6497","Minar Premium Maida 50 Kg","1500","1490","1295","Minar Premium Maida 50 Kg,grocery&staples,flour",
"6498","Aashirvaad Select Atta Pouch 5kg","245","233","218","Aashirvaad Select Atta Pouch 5kg,grocery&staples,flour",
"6499","Aashirvaad Select Atta Pouch 1 kg","50","0","0","Aashirvaad Select Atta Pouch 1 kg,grocery&staples,flour",
"6500","Ratna Gold Idli Rawa 5 Kg","198","180.22","145","Ratna Gold Idli Rawa 5 Kg,grocery&staples,flour",
"6501","Ratna Gold Bombay Rawa 5 Kg","228","205.6","167","Ratna Gold Bombay Rawa 5 Kg,grocery&staples,flour",
"6502","VSR Maida Pouch 1kg","44","40","0","VSR Maida Pouch 1kg,grocery&staples,flour",
"6503","VSR Maida Pouch 500 gm","22","20","0","VSR Maida Pouch 500 gm,grocery&staples,flour",
"6504","Aashirvad Multigrain Atta 5 Kg","255","237.98","228","Aashirvad Multigrain Atta 5 Kg,grocery&staples,flour",
"6505","VSR Idly Rawa Pouch 1kg","42","0","0","VSR Idly Rawa Pouch 1kg,grocery&staples,flour",
"6506","VSR Idly Rawa Pouch 500 gm","23","0","0","VSR Idly Rawa Pouch 500 gm,grocery&staples,flour",
"6507","Aashirvaad Chakki Atta 10 Kg","400","345","330","Aashirvaad Chakki Atta 10 Kg,grocery&staples,flour",
"6508","Annapurna Whole Wheat Atta Pouch 5kg","220","208","0","Annapurna Whole Wheat Atta Pouch 5kg,grocery&staples,flour",
"6509","VSR Wheat Rava Pouch 1kg","55","0","0","VSR Wheat Rava Pouch 1kg,grocery&staples,flour",
"6510","VSR Wheat Rava Pouch 500 gm","28","0","0","VSR Wheat Rava Pouch 500 gm,grocery&staples,flour",
"6511","Nutrela Ready Mix Dhokla, 180 g","40","0","0","Nutrela Ready Mix Dhokla, 180 g,grocery&staples,flour",
"6512","VSR Rice Flour Pouch 1kg","45","0","0","VSR Rice Flour Pouch 1kg,grocery&staples,flour",
"6513","VSR Rice Flour Pouch 500 gm","24","0","0","VSR Rice Flour Pouch 500 gm,grocery&staples,flour",
"6514","Chandni Chowk Basmati Rice, 20 Kg","2480","0","0","Chandni Chowk Basmati Rice, 20 Kg,grocery&staples,flour",
"6515","Millet Bowl Jowar Flour Pouch 1kg","85","0","0","Millet Bowl Jowar Flour Pouch 1kg,grocery&staples,flour",
"6516","Lapsi Rawa Big 500gm","27","0","0","Lapsi Rawa Big 500gm,grocery&staples,flour",
"6517","Priya Gulab Jamun Mix 180 g","80","0","0","Priya Gulab Jamun Mix 180 g,grocery&staples,flour",
"6518","Double Parrot Besan 10 Kg","1000","754.16","667","Double Parrot Besan 10 Kg,grocery&staples,flour",
"6519","Naturralle Rawa Idli, 1 Kg","45","32.62","27","Naturralle Rawa Idli, 1 Kg,grocery&staples,flour",
"6520","Naturralle Rawa Idli, 25 kg","675","594.6","547","Naturralle Rawa Idli, 25 kg,grocery&staples,flour",
"6522","Nutrela Ready Mix Upma, 180 g","40","0","0","Nutrela Ready Mix Upma, 180 g,grocery&staples,flour",
"6523","Double Parrot Besan 30 Kg","3000","2013.19","1858","Double Parrot Besan 30 Kg,grocery&staples,flour",
"6524","VSR Bombay Rawa Pouch 1kg","48","0","0","VSR Bombay Rawa Pouch 1kg,grocery&staples,flour",
"6525","VSR Bombay Rawa Pouch 500 gm","25","0","0","VSR Bombay Rawa Pouch 500 gm,grocery&staples,flour",
"6526","Brown Rawa 1kg","150","141","0","Brown Rawa 1kg,grocery&staples,flour",
"6527","Brown Rawa 500 gm","80","73","0","Brown Rawa 500 gm,grocery&staples,flour",
"6528","Pillsbury Atta With Multi Grains Pouch 5kg","255","0","0","Pillsbury Atta With Multi Grains Pouch 5kg,grocery&staples,flour",
"6529","Pillsbury Atta With Multi Grains Pouch 1kg","52","48.9","44","Pillsbury Atta With Multi Grains Pouch 1kg,grocery&staples,flour",
"6530","Fortune Kachi Ghani Pure Mustard Oil 1 L","152","118.34","0","Fortune Kachi Ghani Pure Mustard Oil 1 L,grocery&staples,oil&ghee",
"6531","Sundrop Olivea Oil, 5 L","938","908.2","0","Sundrop Olivea Oil, 5 L,grocery&staples,oil&ghee",
"6532","Adhar Sunflower Oil Pouch, 1 L","100","79.24","0","Adhar Sunflower Oil Pouch, 1 L,grocery&staples,oil&ghee",
"6533","Fortune Plus Sunflower Oil, 5 L","620","527.88","416","Fortune Plus Sunflower Oil, 5 L,grocery&staples,oil&ghee",
"6534","Ruchi Gold Refined Palmolein 15L Tin","1415","957","945","Ruchi Gold Refined Palmolein 15L Tin,grocery&staples,oil&ghee",
"6535","Ruchi Gold Refined Palmolein 1L Pouch","86","60","52","Ruchi Gold Refined Palmolein 1L Pouch,grocery&staples,oil&ghee",
"6536","Fortune Plus Sunflower Oil, 1 L","109","98.74","78","Fortune Plus Sunflower Oil, 1 L,grocery&staples,oil&ghee",
"6537","Saffola Total Oil Jar, 5 L","925","884.95","0","Saffola Total Oil Jar, 5 L,grocery&staples,oil&ghee",
"6538","Sundrop Heart Oil Jar, 5 L","988","958.48","941","Sundrop Heart Oil Jar, 5 L,grocery&staples,oil&ghee",
"6539","Sundrop Heart Oil Pouch, 1 L","195","190.54","186","Sundrop Heart Oil Pouch, 1 L,grocery&staples,oil&ghee",
"6540","Sundrop Superlite Refined Oil Jar, 5 L","913","881.14","0","Sundrop Superlite Refined Oil Jar, 5 L,grocery&staples,oil&ghee",
"6541","Sundrop Superlite Refined Oil Pouch, 1 L","180","174.8","0","Sundrop Superlite Refined Oil Pouch, 1 L,grocery&staples,oil&ghee",
"6542","Saffola Gold Oil Jar, 15 L","2140","2088.09","2038","Saffola Gold Oil Jar, 15 L,grocery&staples,oil&ghee",
"6543","Saffola Gold Oil Pouch, 1 L","160","144.8","0","Saffola Gold Oil Pouch, 1 L,grocery&staples,oil&ghee",
"6544","Sundrop Lite Oil Jar, 5 L","495","493.2","490","Sundrop Lite Oil Jar, 5 L,grocery&staples,oil&ghee",
"6545","Sundrop Olivea Oil Bottle, 1 L","185","178.2","0","Sundrop Olivea Oil Bottle, 1 L,grocery&staples,oil&ghee",
"6546","Gold Drop Refined Sunflower Oil Jar 5Ltr","550","466","0","Gold Drop Refined Sunflower Oil Jar 5Ltr,grocery&staples,oil&ghee",
"6547","Gold Drop Refined Sunflower Oil Jar 1Ltr","99","88.9","0","Gold Drop Refined Sunflower Oil Jar 1Ltr,grocery&staples,oil&ghee",
"6548","Naturralle Sunflower Oil Jar, 5 L","540","538.9","437","Naturralle Sunflower Oil Jar, 5 L,grocery&staples,oil&ghee",
"6549","Sundrop Lite Oil Pouch, 1 L","99","97.2","0","Sundrop Lite Oil Pouch, 1 L,grocery&staples,oil&ghee",
"6550","Krishna Gold Ground Nut Oil Tin, 15 Kg","1300","1196","1086","Krishna Gold Ground Nut Oil Tin, 15 Kg,grocery&staples,oil&ghee",
"6551","Sundrop Superlite Refined Oil Jar, 15 L","2150","2084","0","Sundrop Superlite Refined Oil Jar, 15 L,grocery&staples,oil&ghee",
"6552","Healthy Heart Refined Sunflower Oil Pouch 1Ltr","115","110.3","77","Healthy Heart Refined Sunflower Oil Pouch 1Ltr,grocery&staples,oil&ghee",
"6554","Ruchi No 1 Vanaspati Pouch, 500 ml","48","34.4","24","Ruchi No 1 Vanaspati Pouch, 500 ml,grocery&staples,oil&ghee",
"6555","Vijaya Refined Sunflower Oil Jar 5L","500","459","0","Vijaya Refined Sunflower Oil Jar 5L,grocery&staples,oil&ghee",
"6556","Vijaya Refined Sunflower Oil Jar 1L","94","84","0","Vijaya Refined Sunflower Oil Jar 1L,grocery&staples,oil&ghee",
"6557","Ruchi No 1 Vanaspati Pouch, 1 L","85","48.59","52","Ruchi No 1 Vanaspati Pouch, 1 L,grocery&staples,oil&ghee",
"6558","Saffola Gold Oil Can 5L","750","731.2","714","Saffola Gold Oil Can 5L,grocery&staples,oil&ghee",
"6559","Saffola Gold Oil Can 2L","300","0","0","Saffola Gold Oil Can 2L,grocery&staples,oil&ghee",
"6560","Saffola Gold Oil Pouch 1L","130","127","124","Saffola Gold Oil Pouch 1L,grocery&staples,oil&ghee",
"6561","Ruchi Gold Palm Oil Tin, 15 Kg","1415","960","945","Ruchi Gold Palm Oil Tin, 15 Kg,grocery&staples,oil&ghee",
"6562","Ruchi Gold Palm Oil Pouch, 1 L","86","74","0","Ruchi Gold Palm Oil Pouch, 1 L,grocery&staples,oil&ghee",
"6563","Saffola Tasty Oil Pouch, 1 L","105","105","100","Saffola Tasty Oil Pouch, 1 L,grocery&staples,oil&ghee",
"6564","Saffola Tasty Oil Jar, 5 L","530","530","525","Saffola Tasty Oil Jar, 5 L,grocery&staples,oil&ghee",
"6565","Nature Fresh Pomace Olive Oil, 1 L","250","0","0","Nature Fresh Pomace Olive Oil, 1 L,grocery&staples,oil&ghee",
"6566","Aadhar Refined Sunflower Oil Pouch 1L","118","90","0","Aadhar Refined Sunflower Oil Pouch 1L,grocery&staples,oil&ghee",
"6567","Naturralle Refind Sunflower Oil Pouh 1L","99","89","77","Naturralle Refind Sunflower Oil Pouh 1L,grocery&staples,oil&ghee",
"6569","Agrigold Rice Bran Oil Pouch, 1 L","99","0","0","Agrigold Rice Bran Oil Pouch, 1 L,grocery&staples,oil&ghee",
"6570","Agrigold Sunflower Oil Tin, 15 Kg","1600","1237.24","0","Agrigold Sunflower Oil Tin, 15 Kg,grocery&staples,oil&ghee",
"6571","Priya Refined Sunflower Oil Jar 5L","520","499","435","Priya Refined Sunflower Oil Jar 5L,grocery&staples,oil&ghee",
"6572","Priya Refined Sunflower Oil Jar 1L","93","91","0","Priya Refined Sunflower Oil Jar 1L,grocery&staples,oil&ghee",
"6573","Agrigold Sunflower Oil Pouch, 1 L","99","0","0","Agrigold Sunflower Oil Pouch, 1 L,grocery&staples,oil&ghee",
"6574","Healthy Heart Sunflower Oil Jar, 5 L","499","455.79","401","Healthy Heart Sunflower Oil Jar, 5 L,grocery&staples,oil&ghee",
"6575","Priya Palm Rich Palmlein Oil 1L Pouch","71","69","0","Priya Palm Rich Palmlein Oil 1L Pouch,grocery&staples,oil&ghee",
"6576","Sundrop Heart Lite Oil 1L Bottle","195","192","0","Sundrop Heart Lite Oil 1L Bottle,grocery&staples,oil&ghee",
"6577","Healthy Heart Sunflower Oil Tin, 15 Kg","1500","1362","1235","Healthy Heart Sunflower Oil Tin, 15 Kg,grocery&staples,oil&ghee",
"6578","Healthy Heart Rice Bran Oil Tin, 15 Kg","1500","1150.5","1051","Healthy Heart Rice Bran Oil Tin, 15 Kg,grocery&staples,oil&ghee",
"6579","Healthy Heart Rice Bran Oil Pouch, 1 L","169","78","0","Healthy Heart Rice Bran Oil Pouch, 1 L,grocery&staples,oil&ghee",
"6580","Healthy Heart Sunflower Oil Pouch, 1 L","115","99.73","77","Healthy Heart Sunflower Oil Pouch, 1 L,grocery&staples,oil&ghee",
"6581","Gold Drop Vanaspati Pouch, 1 L","99","61","0","Gold Drop Vanaspati Pouch, 1 L,grocery&staples,oil&ghee",
"6582","Freedom Refined Sun flower Oil 5ltr Jar","555","489","442","Freedom Refined Sun flower Oil 5ltr Jar,grocery&staples,oil&ghee",
"6583","Freedom Refined Sun flower Oil 1ltr","109","100.89","83","Freedom Refined Sun flower Oil 1ltr,grocery&staples,oil&ghee",
"6584","Gold Drop Palm Oil Tin, 15 Kg","1300","984.05","900","Gold Drop Palm Oil Tin, 15 Kg,grocery&staples,oil&ghee",
"6585","Gold Drop Palm Oil Pouch, 1 L","96","60","52","Gold Drop Palm Oil Pouch, 1 L,grocery&staples,oil&ghee",
"6586","Sundrop Healthy World Rice Bran Oil Lar 5L","625","0","0","Sundrop Healthy World Rice Bran Oil Lar 5L,grocery&staples,oil&ghee",
"6587","Orezulei Rice Bran Oil 1L Bottle","225","0","0","Orezulei Rice Bran Oil 1L Bottle,grocery&staples,oil&ghee",
"6588","Gold Drop Sunflower Oil Tin, 15 Kg","1399","1385","1330","Gold Drop Sunflower Oil Tin, 15 Kg,grocery&staples,oil&ghee",
"6589","Gold Drop Sunflower Oil Jar, 5 L","550","489","442","Gold Drop Sunflower Oil Jar, 5 L,grocery&staples,oil&ghee",
"6590","Naturralle Refined Sunflowerr Oil Bottle 5L","540","530.2","437","Naturralle Refined Sunflowerr Oil Bottle 5L,grocery&staples,oil&ghee",
"6591","Fortune Plus Sunlite Sunflower Oil Jar 5L","620","493.19","0","Fortune Plus Sunlite Sunflower Oil Jar 5L,grocery&staples,oil&ghee",
"6592","Fortune Plus Sunlite Sunflower Oil Jar 1L","121","94","0","Fortune Plus Sunlite Sunflower Oil Jar 1L,grocery&staples,oil&ghee",
"6593","Gold Drop Sunflower Oil Pouch, 1 L","99","89.25","83","Gold Drop Sunflower Oil Pouch, 1 L,grocery&staples,oil&ghee",
"6594","Priya Palm Oil Pouch, 1 L","71","60.76","0","Priya Palm Oil Pouch, 1 L,grocery&staples,oil&ghee",
"6595","Healthy Heart Refined Rice Bran Oil  1L Pouch","169","78","68","Healthy Heart Refined Rice Bran Oil  1L Pouch,grocery&staples,oil&ghee",
"6596","Fortune Rice Bran Healthy Oil 5L Can","575","569","560","Fortune Rice Bran Healthy Oil 5L Can,grocery&staples,oil&ghee",
"6597","Fortune Rice Bran Healthy Oil 1L Pouch","115","110","98","Fortune Rice Bran Healthy Oil 1L Pouch,grocery&staples,oil&ghee",
"6598","Priya Ground Nut Oil Pouch, 1 L","128","124","0","Priya Ground Nut Oil Pouch, 1 L,grocery&staples,oil&ghee",
"6599","Priya Sunflower Oil Tin, 15 Kg","1650","1456.6","1401","Priya Sunflower Oil Tin, 15 Kg,grocery&staples,oil&ghee",
"6600","Priya Sunflower Oil Jar, 5 L","520","510.1","0","Priya Sunflower Oil Jar, 5 L,grocery&staples,oil&ghee",
"6601","Priya Sunflower Oil Pouch, 1 L","93","89.12","81","Priya Sunflower Oil Pouch, 1 L,grocery&staples,oil&ghee",
"6602","Priya Rice Rich Oil Tin, 15 Kg","1500","1260.39","0","Priya Rice Rich Oil Tin, 15 Kg,grocery&staples,oil&ghee",
"6603","Priya Rice Rich Oil Jar, 5 L","510","450.43","398","Priya Rice Rich Oil Jar, 5 L,grocery&staples,oil&ghee",
"6604","Priya Rice Rich Oil Pouch, 1 L","92","84.9","73","Priya Rice Rich Oil Pouch, 1 L,grocery&staples,oil&ghee",
"6605","Sundrop Super Lite Advanced Refind Oil Pouch 1L","183","180","0","Sundrop Super Lite Advanced Refind Oil Pouch 1L,grocery&staples,oil&ghee",
"6606","Freedom Sunflower Oil Jar, 5 L","555","489","0","Freedom Sunflower Oil Jar, 5 L,grocery&staples,oil&ghee",
"6607","Freedom Kachighani Mustard Bottle 1Ltr","138","0","0","Freedom Kachighani Mustard Bottle 1Ltr,grocery&staples,oil&ghee",
"6608","Freedom Sunflower Oil Tin, 15 Kg","1650","1475","1305","Freedom Sunflower Oil Tin, 15 Kg,grocery&staples,oil&ghee",
"6609","Freedom Sunflower Oil Pouch, 1 L","109","89.4","0","Freedom Sunflower Oil Pouch, 1 L,grocery&staples,oil&ghee",
"6610","Vijaya Sunflower Oil Tin 15 Kg","1444","1362.63","1310","Vijaya Sunflower Oil Tin 15 Kg,grocery&staples,oil&ghee",
"6611","Vijaya Sunflower Oil Jar 5 L","549","520","432","Vijaya Sunflower Oil Jar 5 L,grocery&staples,oil&ghee",
"6612","Vijaya Groundnut Oil Pouch 1 L","121","115","104","Vijaya Groundnut Oil Pouch 1 L,grocery&staples,oil&ghee",
"6613","Vijaya Sunflower Oil Pouch 1 L","97","85.1","81","Vijaya Sunflower Oil Pouch 1 L,grocery&staples,oil&ghee",
"6614","Vijaya Rice Bran Oil Pouch 1 L","82","74.4","66","Vijaya Rice Bran Oil Pouch 1 L,grocery&staples,oil&ghee",
"6615","Agrigold Palm Oil Tin, 15 Kg","1450","1067","0","Agrigold Palm Oil Tin, 15 Kg,grocery&staples,oil&ghee",
"6616","Agrigold Palm Oil Pouch, 1 L","81","64.2","0","Agrigold Palm Oil Pouch, 1 L,grocery&staples,oil&ghee",
"6617","Agrigold Sunflower Oil Jar, 5 L","550","0","0","Agrigold Sunflower Oil Jar, 5 L,grocery&staples,oil&ghee",
"6618","Fortune Oil Mustard Kachi Ghani 1Ltr Bottle","152","149","110","Fortune Oil Mustard Kachi Ghani 1Ltr Bottle,grocery&staples,oil&ghee",
"6619","Fortune Oil Mustard Kachi Ghani 500ml Bottle","72","0","0","Fortune Oil Mustard Kachi Ghani 500ml Bottle,grocery&staples,oil&ghee",
"6620","Sundrop Super Lite Advanced Refind Oil Jar1L","183","180","0","Sundrop Super Lite Advanced Refind Oil Jar1L,grocery&staples,oil&ghee",
"6621","Sundrop Super Lite Advanced Refind Oil Jar2L","366","0","0","Sundrop Super Lite Advanced Refind Oil Jar2L,grocery&staples,oil&ghee",
"6622","Sundrop Super Lite Advanced Refind Oil Jar5L","913","905","0","Sundrop Super Lite Advanced Refind Oil Jar5L,grocery&staples,oil&ghee",
"6623","Fortune Soya Health Refind Oil Pouch 1L","110","106","0","Fortune Soya Health Refind Oil Pouch 1L,grocery&staples,oil&ghee",
"6624","Modi Naturals Oleev Active Blended Edible Vegetable Oil Pouch 1L","165","0","0","Modi Naturals Oleev Active Blended Edible Vegetable Oil Pouch 1L,grocery&staples,oil&ghee",
"6625","Sundrop Nutri Lite Refind Oil 5LCan","713","0","0","Sundrop Nutri Lite Refind Oil 5LCan,grocery&staples,oil&ghee",
"6626","Sundrop Nutri Lite Refind Oil 1L Pouch","135","0","0","Sundrop Nutri Lite Refind Oil 1L Pouch,grocery&staples,oil&ghee",
"6627","Hudson Canola Oil 5L Can","1399","0","0","Hudson Canola Oil 5L Can,grocery&staples,oil&ghee",
"6628","Hudson Canola Oil pure and natural 5L Can","699","589","0","Hudson Canola Oil pure and natural 5L Can,grocery&staples,oil&ghee",
"6629","Saffola Tasty Losorb Oil 5L Can","530","530","0","Saffola Tasty Losorb Oil 5L Can,grocery&staples,oil&ghee",
"6630","Saffola Tasty Losorb Oil 1L Pouch","105","105","0","Saffola Tasty Losorb Oil 1L Pouch,grocery&staples,oil&ghee",
"6631","Saffola Total Losorb Oil 5L Can","925","900","881","Saffola Total Losorb Oil 5L Can,grocery&staples,oil&ghee",
"6632","Saffola Total Losorb Oil 2L Can","370","0","0","Saffola Total Losorb Oil 2L Can,grocery&staples,oil&ghee",
"6633","Saffola Active Losorb Oil 5L Can","655","0","0","Saffola Active Losorb Oil 5L Can,grocery&staples,oil&ghee",
"6634","Saffola Active Losorb Oil 1L Pouch","130","0","0","Saffola Active Losorb Oil 1L Pouch,grocery&staples,oil&ghee",
"6635","Vijaya Refined Palmolien Oil Pouch 1L","64","60","56","Vijaya Refined Palmolien Oil Pouch 1L,grocery&staples,oil&ghee",
