"product_id","name","price","d_price","w_price","search_keyword",
"15424","Tim Tam Chocolate Sandwich Biscuit 60 gm ","65","0","0","Tim Tam Chocolate Sandwich Biscuit 60 gm ,packaged food,processed foods,",
"15425","Tim Tam Choco Vanilla Flavored Sandwich Biscuit 120 gm Pouch","115","0","0","Tim Tam Choco Vanilla Flavored Sandwich Biscuit 120 gm Pouch,packaged food,processed foods,",
"15426","Sunfeast Dream Cream Choco Vanilla, 150 g","20","0","0","Sunfeast Dream Cream Choco Vanilla, 150 g,packaged food,processed foods,",
"15427","Sunfeast Dream Cream Strawberry Vanila, 150 g","20","0","0","Sunfeast Dream Cream Strawberry Vanila, 150 g,packaged food,processed foods,",
"15428","Lotte Choco Pie 336 gm Carton","140","0","0","Lotte Choco Pie 336 gm Carton,packaged food,processed foods,",
"15429","Lotte Choco Pie 168 gm Carton","70","0","0","Lotte Choco Pie 168 gm Carton,packaged food,processed foods,",
"15430","Lotte Choco Pie 504 gm Carton","200","0","0","Lotte Choco Pie 504 gm Carton,packaged food,processed foods,",
"15431","Mc Vities Choco Creams 63 gm Pouch","10","0","0","Mc Vities Choco Creams 63 gm Pouch,packaged food,processed foods,",
"15432","Mc Vities Biscuits 100 gm Pouch","25","0","0","Mc Vities Biscuits 100 gm Pouch,packaged food,processed foods,",
"15433","Orion Choco Pie 372 gm Carton","140","0","0","Orion Choco Pie 372 gm Carton,packaged food,processed foods,",
"15434","Orion Choco Pie 186 gm Carton","70","0","0","Orion Choco Pie 186 gm Carton,packaged food,processed foods,",
"15435","Orion Choco Pie 124 gm Carton","50","0","0","Orion Choco Pie 124 gm Carton,packaged food,processed foods,",
"15436","Parle Golden Arcs Apple 75 gm Pouch","25","0","0","Parle Golden Arcs Apple 75 gm Pouch,packaged food,processed foods,",
"15437","Tim Tam Chocolate Sandwich Biscuit 120 gm Pouch","115","0","0","Tim Tam Chocolate Sandwich Biscuit 120 gm Pouch,packaged food,processed foods,",
"15438","Parle Hide & Seek Bourbon 150 gm Pouch","10","0","0","Parle Hide & Seek Bourbon 150 gm Pouch,packaged food,processed foods,",
"15439","Mejji Yan Yan Creamy Vanilla Flavoured Dip Biscuits Sack 50 gm","70","0","0","Mejji Yan Yan Creamy Vanilla Flavoured Dip Biscuits Sack 50 gm,packaged food,processed foods,",
"15440","Parle Hide & Seek Fab Chocolate 100 gm Pouch ","20","0","0","Parle Hide & Seek Fab Chocolate 100 gm Pouch ,packaged food,processed foods,",
"15441","Parle Golden Arcs Strawberry 150 gm Pouch","40","0","0","Parle Golden Arcs Strawberry 150 gm Pouch,packaged food,processed foods,",
"15442","Parle Golden Arcs Strawberry 75 gm Pouch","25","0","0","Parle Golden Arcs Strawberry 75 gm Pouch,packaged food,processed foods,",
"15443","Parle Jam In Biscuit 150gm Pouch","20","0","0","Parle Jam In Biscuit 150gm Pouch,packaged food,processed foods,",
"15444","Parle Jam In Biscuit 75gm Pouch","10","0","0","Parle Jam In Biscuit 75gm Pouch,packaged food,processed foods,",
"15445","Parle Hide & Sheek Black Bourbon Choco 100 gm Pouch","25","0","0","Parle Hide & Sheek Black Bourbon Choco 100 gm Pouch,packaged food,processed foods,",
"15446","Parle Kreams Gold Elaichi Biscuits 200 gm PCK","20","0","0","Parle Kreams Gold Elaichi Biscuits 200 gm PCK,packaged food,processed foods,",
"15447","Parle Hide & Seek Fab Orange 100 gm Pouch","20","0","0","Parle Hide & Seek Fab Orange 100 gm Pouch,packaged food,processed foods,",
"15448","Parle Hide & Seek Feb Strawberry 100 gm Pouch","20","0","0","Parle Hide & Seek Feb Strawberry 100 gm Pouch,packaged food,processed foods,",
"15449","Parle Kreams Gold Orange Biscuits 200 gm Pack","20","0","0","Parle Kreams Gold Orange Biscuits 200 gm Pack,packaged food,processed foods,",
"15450","Sanfeast Dark Fantacy Luxuria Choco Fills 150 gm Carton","60","0","0","Sanfeast Dark Fantacy Luxuria Choco Fills 150 gm Carton,packaged food,processed foods,",
"15451","Parle Golden Arcs Crunchy Choco Fills 200 gm Carton","75","0","0","Parle Golden Arcs Crunchy Choco Fills 200 gm Carton,packaged food,processed foods,",
"15452","Parle Happy Happy Chocolate Sandwich Biscuits 60 gm Pouch","10","0","0","Parle Happy Happy Chocolate Sandwich Biscuits 60 gm Pouch,packaged food,processed foods,",
"15453","Parle Happy Happy Chocolate Sandwich Biscuits 120 gm Pouch","20","0","0","Parle Happy Happy Chocolate Sandwich Biscuits 120 gm Pouch,packaged food,processed foods,",
"15454","Parle Hide & Seek Fab Vanilla 100 gm Pouch","20","0","0","Parle Hide & Seek Fab Vanilla 100 gm Pouch,packaged food,processed foods,",
"15455","Parle Happy happy Choco Chip Cookies 150 gm","20","0","0","Parle Happy happy Choco Chip Cookies 150 gm,packaged food,processed foods,",
"15456","Sanfeast Special Tasty Choco Cream Biscuits 100 gm","10","0","0","Sanfeast Special Tasty Choco Cream Biscuits 100 gm,packaged food,processed foods,",
"15457","Parle Golden Arcs Choco 150 gm Pouch","45","0","0","Parle Golden Arcs Choco 150 gm Pouch,packaged food,processed foods,",
"15458","Parle Golden Arcs Choco 75 gm Pouch","25","0","0","Parle Golden Arcs Choco 75 gm Pouch,packaged food,processed foods,",
"15459","Sunfeast Dream Cream Bourbon Delight 120 gm Pouch","20","0","0","Sunfeast Dream Cream Bourbon Delight 120 gm Pouch,packaged food,processed foods,",
"15460","Sunfeast Dream Cream Butterscotch Zing120 gm Pouch","20","0","0","Sunfeast Dream Cream Butterscotch Zing120 gm Pouch,packaged food,processed foods,",
"15461","Lehar Namkeen Moong Dal, 40 g","10","0","0","Lehar Namkeen Moong Dal, 40 g,packaged food,processed foods,",
"15462","Lehar Namkeen Moong Dal, 18 g","60","0","0","Lehar Namkeen Moong Dal, 18 g,packaged food,processed foods,",
"15463","Lehar Namkeen Aloo Bhujia, 45 g","10","0","0","Lehar Namkeen Aloo Bhujia, 45 g,packaged food,processed foods,",
"15464","Lehar Namkeen Aloo Bhujia, 20 g","60","0","0","Lehar Namkeen Aloo Bhujia, 20 g,packaged food,processed foods,",
"15465","Kanha Namkeen Tastynut, 400 g","82","0","0","Kanha Namkeen Tastynut, 400 g,packaged food,processed foods,",
"15466","Kanha Namkeen Navratan Mix, 400 g","82","0","0","Kanha Namkeen Navratan Mix, 400 g,packaged food,processed foods,",
"15467","Kanha Namkeen Khatta Meetha, 400 g","82","0","0","Kanha Namkeen Khatta Meetha, 400 g,packaged food,processed foods,",
"15468","Kanha Namkeen Corn Flakes, 400 g","115","0","0","Kanha Namkeen Corn Flakes, 400 g,packaged food,processed foods,",
"15469","Kanha Namkeen Boondi, 160 g","32","0","0","Kanha Namkeen Boondi, 160 g,packaged food,processed foods,",
"15470","Kanha Namkeen Bhujia, 1 Kg","200","0","0","Kanha Namkeen Bhujia, 1 Kg,packaged food,processed foods,",
"15471","Haldiram Namkeen Samosa, 200 g","48","0","0","Haldiram Namkeen Samosa, 200 g,packaged food,processed foods,",
"15472","Haldiram Namkeen Pancharatan Mix ,150 g","55","0","0","Haldiram Namkeen Pancharatan Mix ,150 g,packaged food,processed foods,",
"15473","Haldiram Namkeen Navaratan Mix, 150 g","38","0","0","Haldiram Namkeen Navaratan Mix, 150 g,packaged food,processed foods,",
"15474","Haldiram Namkeen Murukku, 200 g","48","0","0","Haldiram Namkeen Murukku, 200 g,packaged food,processed foods,",
"15475","Haldiram Namkeen Mixture, 350 g","65","0","0","Haldiram Namkeen Mixture, 350 g,packaged food,processed foods,",
"15476","Haldiram Namkeen Mixture, 150 g","30","0","0","Haldiram Namkeen Mixture, 150 g,packaged food,processed foods,",
"15477","Haldiram Namkeen Mathri, 200 g","48","0","0","Haldiram Namkeen Mathri, 200 g,packaged food,processed foods,",
"15478","Haldiram Namkeen Khatta Meetha, 350 g","65","0","0","Haldiram Namkeen Khatta Meetha, 350 g,packaged food,processed foods,",
"15479","Haldiram Namkeen Khatta Meetha, 150 g","30","0","0","Haldiram Namkeen Khatta Meetha, 150 g,packaged food,processed foods,",
"15480","Haldiram Namkeen Fata Fat Bhel, 70 g","25","0","0","Haldiram Namkeen Fata Fat Bhel, 70 g,packaged food,processed foods,",
"15481","Haldiram Namkeen Dry Fruit Mixture, 150 g","56","0","0","Haldiram Namkeen Dry Fruit Mixture, 150 g,packaged food,processed foods,",
"15482","Haldiram Namkeen Dal Moth, 150 g","34","0","0","Haldiram Namkeen Dal Moth, 150 g,packaged food,processed foods,",
"15483","Haldiram Namkeen Bhujia Sev, 350 g","76","0","0","Haldiram Namkeen Bhujia Sev, 350 g,packaged food,processed foods,",
"15484","Haldiram Namkeen Bhujia Sev, 150 g","34","0","0","Haldiram Namkeen Bhujia Sev, 150 g,packaged food,processed foods,",
"15485","Haldiram Namkeen Bhakarwadi, 200 g","48","0","0","Haldiram Namkeen Bhakarwadi, 200 g,packaged food,processed foods,",
"15486","Haldiram Namkeen All In One, 350 g","80","0","0","Haldiram Namkeen All In One, 350 g,packaged food,processed foods,",
"15487","Haldiram Namkeen All In One, 150 g","36","0","0","Haldiram Namkeen All In One, 150 g,packaged food,processed foods,",
"15488","Aakash Namkeen Tasty, 20 g","50","32.22","40","Aakash Namkeen Tasty, 20 g,packaged food,processed foods,",
"15489","Aakash Namkeen Ratlami Sev, 20 g","50","32.22","40","Aakash Namkeen Ratlami Sev, 20 g,packaged food,processed foods,",
"15490","Aakash Namkeen Moong Dal, 20 g","50","32.22","40","Aakash Namkeen Moong Dal, 20 g,packaged food,processed foods,",
"15491","Aakash Namkeen Mastana Mix, 150 g","35","0","0","Aakash Namkeen Mastana Mix, 150 g,packaged food,processed foods,",
"15492","Aakash Namkeen Lajawab Mix, 150 g","35","0","0","Aakash Namkeen Lajawab Mix, 150 g,packaged food,processed foods,",
"15493","Aakash Namkeen Lahsun Sev, 150 g","35","32.32","28","Aakash Namkeen Lahsun Sev, 150 g,packaged food,processed foods,",
"15494","Aakash Namkeen Khatta Mitha, 20 g","50","45.89","40","Aakash Namkeen Khatta Mitha, 20 g,packaged food,processed foods,",
"15495","Aakash Namkeen Khatta Mitha, 150 g","35","32.56","28","Aakash Namkeen Khatta Mitha, 150 g,packaged food,processed foods,",
"15496","Aakash Namkeen Moong Dal, 40 g","10","0","8","Aakash Namkeen Moong Dal, 40 g,packaged food,processed foods,",
"15497","Lehar Namkeen Navratan Mix, 20 g","60","0","0","Lehar Namkeen Navratan Mix, 20 g,packaged food,processed foods,",
"15498","Lehar Namkeen Karare Peanuts 40 g","10","0","0","Lehar Namkeen Karare Peanuts 40 g,packaged food,processed foods,",
"15499","Lehar Namkeen Karare Peanuts 18 g","60","0","0","Lehar Namkeen Karare Peanuts 18 g,packaged food,processed foods,",
"15500","Haldirams Namkeen Aloo Bhujia 1 Kg Pouch","210","0","0","Haldirams Namkeen Aloo Bhujia 1 Kg Pouch,packaged food,processed foods,",
"15501","Haldirams Bhel Puri 150 gm Pouch","50","0","0","Haldirams Bhel Puri 150 gm Pouch,packaged food,processed foods,",
"15502","Haldirams Tasty Nuts 350 gm Pouch","67","0","0","Haldirams Tasty Nuts 350 gm Pouch,packaged food,processed foods,",
"15503","Haldirams Tasty Nuts 150 gm Pouch","30","0","0","Haldirams Tasty Nuts 150 gm Pouch,packaged food,processed foods,",
"15504","Haldirams Aloo Bhujia 150 gm Pouch","35","0","0","Haldirams Aloo Bhujia 150 gm Pouch,packaged food,processed foods,",
"15505","Haldirams Moong Dal 150 gm Pouch","40","0","0","Haldirams Moong Dal 150 gm Pouch,packaged food,processed foods,",
"15506","Haldirams Corn Flakes Mixture 150 gm Pouch","38","0","0","Haldirams Corn Flakes Mixture 150 gm Pouch,packaged food,processed foods,",
"15507","Haldirams Namkeen Chana Choor 150 gm Pouch","35","0","0","Haldirams Namkeen Chana Choor 150 gm Pouch,packaged food,processed foods,",
"15508","Haldirams Namkeen Nimbu Masala 150 gm Pouch","30","0","0","Haldirams Namkeen Nimbu Masala 150 gm Pouch,packaged food,processed foods,",
"15509","Haldirams Lahsun Sev 150 gm Pouch","30","0","0","Haldirams Lahsun Sev 150 gm Pouch,packaged food,processed foods,",
"15510","ACT II Bakes Tomato With Chilly 40 gm Pouch","10","0","0","ACT II Bakes Tomato With Chilly 40 gm Pouch,packaged food,processed foods,",
"15511","ACT II Bakes Cheese With Herbs 40 gm Pouch","10","0","0","ACT II Bakes Cheese With Herbs 40 gm Pouch,packaged food,processed foods,",
"15512","ACT II Popcorn Fundoo Masala Flavour 35 gm Pouch","20","0","0","ACT II Popcorn Fundoo Masala Flavour 35 gm Pouch,packaged food,processed foods,",
"15513","ACT II Popcorn Tomato Chilli Flavour 35 gm Pouch","20","0","0","ACT II Popcorn Tomato Chilli Flavour 35 gm Pouch,packaged food,processed foods,",
"15514","ACT II Bakes Cheese With Herbs 80 gm Pouch","20","0","0","ACT II Bakes Cheese With Herbs 80 gm Pouch,packaged food,processed foods,",
"15515","ACT II Bakes Tomato With Chilly 80 gm Pouch","20","0","0","ACT II Bakes Tomato With Chilly 80 gm Pouch,packaged food,processed foods,",
"15516","Act II Microwave Popcorn Butter, 99 g","165","0","0","Act II Microwave Popcorn Butter, 99 g,packaged food,processed foods,",
"15517","Act II Microwave Popcorn Natural, 99 g","65","62.8","59","Act II Microwave Popcorn Natural, 99 g,packaged food,processed foods,",
"15518","Act II Instant Popcorn Premium, 280 g","100","0","0","Act II Instant Popcorn Premium, 280 g,packaged food,processed foods,",
"15519","Act II Ready To Eat Popcorn Strawberry, 35 g","20","0","0","Act II Ready To Eat Popcorn Strawberry, 35 g,packaged food,processed foods,",
"15520","Act II Microwave Popcorn Natural, 99 g","60","0","0","Act II Microwave Popcorn Natural, 99 g,packaged food,processed foods,",
"15521","Act II Microwave Popcorn Natural, Pack Of 4 X 33 g","88","83.99","79","Act II Microwave Popcorn Natural, Pack Of 4 X 33 g,packaged food,processed foods,",
"15522","Act II Microwave Popcorn Butter, 99 g","65","63.23","59","Act II Microwave Popcorn Butter, 99 g,packaged food,processed foods,",
"15523","Act II Microwave Popcorn Butter, Pack Of 4 X 33 g","88","83.9","79","Act II Microwave Popcorn Butter, Pack Of 4 X 33 g,packaged food,processed foods,",
"15524","Act II Instant Popcorn Tandoori Tadka, Pack Of 4 U","120","111.11","108","Act II Instant Popcorn Tandoori Tadka, Pack Of 4 U,packaged food,processed foods,",
"15525","Act II Instant Popcorn South Spice, Pack Of 4 U","132","123.45","119","Act II Instant Popcorn South Spice, Pack Of 4 U,packaged food,processed foods,",
"15526","Act II Instant Popcorn Salted, Pack Of 4 X 35 g","40","38.89","36","Act II Instant Popcorn Salted, Pack Of 4 X 35 g,packaged food,processed foods,",
"15527","Act II Instant Popcorn Salted, Pack Of 12 X 15 g","60","0","0","Act II Instant Popcorn Salted, Pack Of 12 X 15 g,packaged food,processed foods,",
"15528","Act II Instant Popcorn Pepper, Pack Of 4 X 63 g","120","0","0","Act II Instant Popcorn Pepper, Pack Of 4 X 63 g,packaged food,processed foods,",
"15529","Act II Instant Popcorn Golden Sizzle, 70 g","33","32.1","30","Act II Instant Popcorn Golden Sizzle, 70 g,packaged food,processed foods,",
"15530","Act II Instant Popcorn Golden, Pack Of 4 X 35 g","40","38.89","36","Act II Instant Popcorn Golden, Pack Of 4 X 35 g,packaged food,processed foods,",
"15531","Act II Instant Popcorn Golden, Pack Of 12 X 15 g","60","0","0","Act II Instant Popcorn Golden, Pack Of 12 X 15 g,packaged food,processed foods,",
"15532","Act II Instant Popcorn Combi Pack","85","83.98","77","Act II Instant Popcorn Combi Pack,packaged food,processed foods,",
"15533","Act II Instant Popcorn Classic Salted, 105 g","33","0","0","Act II Instant Popcorn Classic Salted, 105 g,packaged food,processed foods,",
"15534","Act II Instant Popcorn Chilli, Pack Of 4 X 35 g","40","0","0","Act II Instant Popcorn Chilli, Pack Of 4 X 35 g,packaged food,processed foods,",
"15535","Act II Instant Popcorn Butter, Pack Of 4 X 63 g","132","0","0","Act II Instant Popcorn Butter, Pack Of 4 X 63 g,packaged food,processed foods,",
"15536","Pickwick Wafer Strawberry Jar, 150 g","120","0","0","Pickwick Wafer Strawberry Jar, 150 g,packaged food,processed foods,",
"15537","Pickwick Wafer Chocolate Jar, 150 g","120","0","0","Pickwick Wafer Chocolate Jar, 150 g,packaged food,processed foods,",
"15538","Pickwick Wafer Strawberry, 75 g","40","0","0","Pickwick Wafer Strawberry, 75 g,packaged food,processed foods,",
"15539","Pickwick Wafer Pineapple, 75 g","40","0","0","Pickwick Wafer Pineapple, 75 g,packaged food,processed foods,",
"15540","Pickwick Wafer Orange, 75 g","40","0","0","Pickwick Wafer Orange, 75 g,packaged food,processed foods,",
"15541","Pickwick Wafer Chocolate, 75 g","40","0","0","Pickwick Wafer Chocolate, 75 g,packaged food,processed foods,",
"15542","Dukes Waffy Vanilla, 75 g","35","0","0","Dukes Waffy Vanilla, 75 g,packaged food,processed foods,",
"15543","Dukes Waffy Waffers Strawberry Tin, 300 g","250","0","0","Dukes Waffy Waffers Strawberry Tin, 300 g,packaged food,processed foods,",
"15544","Dukes Waffy Chocolate, 300 g","250","0","0","Dukes Waffy Chocolate, 300 g,packaged food,processed foods,",
"15545","Dukes Waffy Strawberry, 75 g","35","0","0","Dukes Waffy Strawberry, 75 g,packaged food,processed foods,",
"15546","Dukes Waffy Roll Strawberry 250 g","150","0","0","Dukes Waffy Roll Strawberry 250 g,packaged food,processed foods,",
"15547","Dukes Waffy Waffers Chocolate Roll, 250 g","150","0","0","Dukes Waffy Waffers Chocolate Roll, 250 g,packaged food,processed foods,",
"15548","Dukes Waffy Pineapple, 75 g","35","0","0","Dukes Waffy Pineapple, 75 g,packaged food,processed foods,",
"15549","Dukes Waffy Orange , 75 g","35","0","0","Dukes Waffy Orange , 75 g,packaged food,processed foods,",
"15550","Dukes Waffy Chocolate, 75 g","35","0","0","Dukes Waffy Chocolate, 75 g,packaged food,processed foods,",
"15551","Loacker Quadratini Napolitaner Wafers 250 gm Pouch","439","0","0","Loacker Quadratini Napolitaner Wafers 250 gm Pouch,packaged food,processed foods,",
"15552","Loacker Quadratini Cappuccino 110 gm Pouch","259","0","0","Loacker Quadratini Cappuccino 110 gm Pouch,packaged food,processed foods,",
"15553","Loacker Quadratini Tiramisu Wafers 110 gm Pouch","259","0","0","Loacker Quadratini Tiramisu Wafers 110 gm Pouch,packaged food,processed foods,",
"16405","Godrej Expert Creme Hair Colour Natural Brown, 20 g (colo...","30","0","0","Godrej Expert Creme Hair Colour Natural Brown, 20 g (colo...,personal care,hair care,",
"16406","Godrej Expert Creme Hair Colour Dark Brown, 20 g (coloura...","30","0","0","Godrej Expert Creme Hair Colour Dark Brown, 20 g (coloura...,personal care,hair care,",
"16407","Indica Hair Colour Darkest Brown, 40 ml","30","0","0","Indica Hair Colour Darkest Brown, 40 ml,personal care,hair care,",
"16408","Indica Hair Colour Natural Black, 40 ml","30","0","0","Indica Hair Colour Natural Black, 40 ml,personal care,hair care,",
"16409","Godrej Expert Hair Color Black Brown Creme, 20 g","30","0","0","Godrej Expert Hair Color Black Brown Creme, 20 g,personal care,hair care,",
"16410","Godrej Expert Hair Color Natural Black Creme, 20 g","30","0","0","Godrej Expert Hair Color Natural Black Creme, 20 g,personal care,hair care,",
"16411","Setwet Hair Gel Wet Look Hold, 10 ml","10","0","0","Setwet Hair Gel Wet Look Hold, 10 ml,personal care,hair care,",
"16412","Garnier Hair Colour Shade No 1 Hair, 40 ml","69","0","0","Garnier Hair Colour Shade No 1 Hair, 40 ml,personal care,hair care,",
"16413","Nupur Hair Mehendi 500 g","140","0","0","Nupur Hair Mehendi 500 g,personal care,hair care,",
"16414","Nupur Hair Mehendi 60 g","22","0","0","Nupur Hair Mehendi 60 g,personal care,hair care,",
"16415","Nupur Hair Mehendi 150 g","45","0","0","Nupur Hair Mehendi 150 g,personal care,hair care,",
"16416","Godrej Expert Hair Dye Pack of 8 X 3 g","28","0","0","Godrej Expert Hair Dye Pack of 8 X 3 g,personal care,hair care,",
"16417","Loreal Casting Cream Darkest Brown Hair Colour, 72 ml+87.5","575","0","0","Loreal Casting Cream Dark Chocolate Hair Colour, 72 ml,personal care,hair care,",
"16418","Loreal Paris Excel Creme Brown Hair Colour, 72ml+100gm","530","0","0","Loreal Paris Excel Creme Brown Hair Colour, 180 g,personal care,hair care,",
"16419","Loreal Casting Cream Darkest Brown Hair Colour, 72 ml","575","0","0","Loreal Casting Cream Darkest Brown Hair Colour, 72 ml,personal care,hair care,",
"16420","Loreal Casting Cream Ebony Black Hair Colour, 72 ml=87.5","575","0","0","Loreal Casting Cream Ebony Black Hair Colour, 72 ml,personal care,hair care,",
"16421","Loreal Paris Excel Creme Burgundy Hair Colour, 172 g","575","0","0","Loreal Paris Excel Creme Burgundy Hair Colour, 172 g,personal care,hair care,",
"16422","Loreal Paris Excel Creme Burganty  Black Hair Colour, 72ml=100 g","590","0","0","Loreal Paris Excel Creme Black Hair Colour, 180 g,personal care,hair care,",
"16423","Loreal Paris Excel Creme Natural Brown Hair Colour, 172ml+100","590","0","0","Loreal Paris Excel Creme Brown Hair Colour, 172 g,personal care,hair care,",
"16424","Garnier Color Natural Shade No 4 Hair Colour, 100 ml","170","0","0","Garnier Color Natural Shade No 4 Hair Colour, 100 ml,personal care,hair care,",
"16425","Garnier Color Natural Shade No 3 Hair Colour, 100 ml","160","0","0","Garnier Color Natural Shade No 3 Hair Colour, 100 ml,personal care,hair care,",
"16426","Garnier Color Naturals, 4 Brown, 100 ml","160","0","0","Garnier Color Naturals, 4 Brown, 100 ml,personal care,hair care,",
"16427","Garnier Color Naturals, 3.16 Burgundy, 100 ml","160","0","0","Garnier Color Naturals, 3.16 Burgundy, 100 ml,personal care,hair care,",
"16428","Garnier Color Naturals, 3 Darkest Brown, 100 ml","160","0","0","Garnier Color Naturals, 3 Darkest Brown, 100 ml,personal care,hair care,",
"16429","Garnier Color Naturals, 1 Black, 100 ml","160","0","0","Garnier Color Naturals, 1 Black, 100 ml,personal care,hair care,",
"16430","Godrej Expert Creme Hair Colour, Honey Brown, 40 ml","35","0","0","Godrej Expert Creme Hair Colour, Honey Brown, 40 ml,personal care,hair care,",
"16431","Godrej Expert Creme Hair Colour, Cinnamon Red, 40 ml","35","0","0","Godrej Expert Creme Hair Colour, Cinnamon Red, 40 ml,personal care,hair care,",
"16432","Indica Hair Colour Natural Black, Pack of 8 U X 3 g each","136","0","0","Indica Hair Colour Natural Black, Pack of 8 U X 3 g each,personal care,hair care,",
"16433","Garnier Color Natural Shade No 1 Hair Colour,100 ml","160","0","0","Garnier Color Natural Shade No 1 Hair Colour,100 ml,personal care,hair care,",
"16434","Streax Hair Colour Darkest Brown, 40 ml","30","0","0","Streax Hair Colour Darkest Brown, 40 ml,personal care,hair care,",
"16435","Streax Hair Colour Natural Black, 40 ml","30","0","0","Streax Hair Colour Natural Black, 40 ml,personal care,hair care,",
"16436","Bigen Easy and Natural Hair Color N4 Brown","149","0","0","Bigen Easy and Natural Hair Color N4 Brown,personal care,hair care,",
"16437","Bigen Easy and Natural Hair Color N3 Darkest Brown","149","0","0","Bigen Easy and Natural Hair Color N3 Darkest Brown,personal care,hair care,",
"16438","Bigen Easy and Natural Hair Color MH5 ","149","0","0","Bigen Easy and Natural Hair Color MH5 ,personal care,hair care,",
"16439","Park Avenue Shampoo Dry Beer, 200 ml","160","0","0","Park Avenue Shampoo Dry Beer, 200 ml,personal care,hair care,",
"16440","Garnier Fructis Shampoo Good bye Damage, Pack of 12 X 7.5 ml","36","0","0","Garnier Fructis Shampoo Good bye Damage, Pack of 12 X 7.5 ml,personal care,hair care,",
"16441","Kesh King Shampoo 300 ml","174","0","0","Kesh King Shampoo 300 ml,personal care,hair care,",
"16442","Biotique Shampoo Green Apple, 100 ml","68","0","0","Biotique Shampoo Green Apple, 100 ml,personal care,hair care,",
"16443","Himalaya Shampoo Anti Hair Fall, 200 ml","130","0","0","Himalaya Shampoo Anti Hair Fall, 200 ml,personal care,hair care,",
"16444","Himalaya Shampoo Daily Care, Protein Gentle, 200 ml","130","0","0","Himalaya Shampoo Daily Care, Protein Gentle, 200 ml,personal care,hair care,",
"16445","Dove Shampoo Hair Fall Rescue, 650 ml","420","0","0","Dove Shampoo Hair Fall Rescue, 650 ml,personal care,hair care,",
"16446","Dove Shampoo Intense Repair, 650 ml","420","0","0","Dove Shampoo Intense Repair, 650 ml,personal care,hair care,",
"16447","Tresemme Conditioner Smooth & Shine, 225 ml","165","0","0","Tresemme Conditioner Smooth & Shine, 225 ml,personal care,hair care,",
"16448","Tresemme Conditioner Climate Control, 225 ml","165","0","0","Tresemme Conditioner Climate Control, 225 ml,personal care,hair care,",
"16449","Loreal Paris Shampoo Fall Repair, 640 ml","420","0","0","Loreal Paris Shampoo Fall Repair, 640 ml,personal care,hair care,",
"16450","Tresemme Shampoo Smooth & Shine, 600 ml","360","0","0","Tresemme Shampoo Smooth & Shine, 600 ml,personal care,hair care,",
"16451","Tresemme Shampoo Hairfall Defence, 600 ml","360","0","0","Tresemme Shampoo Hairfall Defence, 600 ml,personal care,hair care,",
"16452","Sunsilk Shampoo Black Shine, Pack of 64 U X 6 ml each","64","0","0","Sunsilk Shampoo Black Shine, Pack of 64 U X 6 ml each,personal care,hair care,",
"16453","Dove Shampoo Daily Shine, 650 ml","420","0","0","Dove Shampoo Daily Shine, 650 ml,personal care,hair care,",
"16454","Chik Shampoo Hair Fall Prevent, 325 ml","99","0","0","Chik Shampoo Hair Fall Prevent, 325 ml,personal care,hair care,",
"16455","Loreal Shampoo 6 Oil Nourish, 360 ml","275","0","0","Loreal Shampoo 6 Oil Nourish, 360 ml,personal care,hair care,",
"16456","Meera Shampoo Strong & Healthy, 20 U X 6 ml each","40","0","0","Meera Shampoo Strong & Healthy, 20 U X 6 ml each,personal care,hair care,",
"16457","Tresemme Conditioner Smooth & Shine, 12 U X 7.5 ml each","48","0","0","Tresemme Conditioner Smooth & Shine, 12 U X 7.5 ml each,personal care,hair care,",
"16458","Tresemme Shampoo Hair Fall Defence, 12 U X 7.5 ml each","36","0","0","Tresemme Shampoo Hair Fall Defence, 12 U X 7.5 ml each,personal care,hair care,",
"16460","Dove Conditioner Breakage Therapy, 180 ml","165","0","0","Dove Conditioner Breakage Therapy, 180 ml,personal care,hair care,",
"16461","Tresemme Shampoo Climate Control, 225 ml","130","0","0","Tresemme Shampoo Climate Control, 225 ml,personal care,hair care,",
"16462","Kesh King Shampoo 120 ml","96","0","0","Kesh King Shampoo 120 ml,personal care,hair care,",
"16463","Nyle Shampoo Dryness Control, 600 ml","240","0","0","Nyle Shampoo Dryness Control, 600 ml,personal care,hair care,",
"16464","Nyle Shampoo Smooth & Silky, 600 ml","240","0","0","Nyle Shampoo Smooth & Silky, 600 ml,personal care,hair care,",
